,pr_id,pr_title,pr_number,additions,deletions,pr_changed_files,pr_commits_count,pr_comments_count,pr_review_comments_count,pr_created_at,pr_closed_at,contributor,contributor_id,is_merged,pr_merged_at
0,34673010.0,Support for creating Maven distribution,1.0,77.0,6.0,5.0,3.0,0.0,2.0,2015-05-04 20:42:43,2015-05-11 19:42:14,Mark Bretl,6732519.0,0.0,
1,34729492.0,Allow REST web API to be launched. Eliminate duplicate code,2.0,477.0,304.0,4.0,2.0,0.0,0.0,2015-05-05 14:27:37,2015-06-23 17:50:40,,5561056.0,0.0,
2,34929071.0,Port projectgeode.org,3.0,850.0,11.0,21.0,2.0,4.0,0.0,2015-05-07 15:43:28,2015-07-07 20:57:58,Chloe Jackson,1204932.0,0.0,
3,35764723.0,Minor grammatical fixes,4.0,9.0,9.0,2.0,1.0,1.0,0.0,2015-05-19 19:16:49,2015-07-15 01:11:05,hubbardr,5067336.0,0.0,
4,36215523.0,GEODE-21. Website updates from ProjectGeode.org git,5.0,1299.0,0.0,27.0,1.0,0.0,0.0,2015-05-26 15:38:37,2015-07-15 01:11:12,Roman V Shaposhnik,34680.0,0.0,
5,36368576.0,[GEODE-41] #comment Fix issue #41,6.0,3.0,1.0,1.0,1.0,0.0,0.0,2015-05-28 03:10:59,2015-05-28 05:10:57,William Oliveira,163746.0,1.0,2015-05-28 05:10:57
6,36456184.0,Added note about installDist task to COMPILING.txt,7.0,4.0,0.0,1.0,1.0,0.0,0.0,2015-05-28 22:08:16,2015-06-04 18:38:41,Dan Smith,857521.0,0.0,
7,36963230.0,Testing git2jira Integration,8.0,3.0,1.0,1.0,2.0,0.0,0.0,2015-06-04 18:25:29,2015-06-04 18:35:26,William Oliveira,163746.0,0.0,
8,38174558.0,[GEODE-20] Allow REST API to be launched,9.0,479.0,306.0,4.0,1.0,0.0,0.0,2015-06-20 21:21:56,2015-06-23 17:47:02,,5561056.0,1.0,2015-06-23 17:47:02
9,39933531.0,GEODE-83 Add support for Redis AUTH command,10.0,335.0,27.0,14.0,4.0,3.0,0.0,2015-07-14 16:16:50,2015-07-27 18:30:07,,5885998.0,1.0,2015-07-27 18:30:07
10,39972006.0,GEODE-115 Change gfsh path for integration tests,11.0,3.0,7.0,1.0,1.0,0.0,0.0,2015-07-14 22:53:17,2015-07-15 17:01:48,Jianxia Chen,11181423.0,1.0,2015-07-15 17:01:48
11,41040433.0,Added UnclosableInputStream for SAX parser,12.0,24.0,1.0,1.0,1.0,1.0,0.0,2015-07-28 17:54:45,2015-07-29 16:47:01,Lei Zhang,12564978.0,0.0,
12,41599359.0,Fix for GEODE-109,13.0,2287.0,456.0,104.0,2.0,0.0,3.0,2015-08-04 18:08:55,2015-08-06 18:27:19,,5885998.0,0.0,
13,41815962.0,implemented ability to publish into local maven repository,14.0,16.0,4.0,5.0,1.0,1.0,0.0,2015-08-06 17:59:18,2015-08-06 18:34:23,Konstantin Ignatyev,868783.0,0.0,
14,42283628.0,Fix JMX Http manager incorrect 'start gateway-sender' mapping,15.0,1.0,1.0,1.0,1.0,0.0,0.0,2015-08-12 20:17:36,2015-08-19 23:10:05,,5885998.0,1.0,2015-08-19 23:10:05
15,42726490.0,Handle region create/destroy remote event in Redis adpater,16.0,27.0,13.0,4.0,1.0,0.0,0.0,2015-08-18 17:37:44,2015-08-19 00:50:19,,5885998.0,0.0,
16,42750447.0,Fix for GEODE-222,17.0,105.0,87.0,10.0,2.0,1.0,0.0,2015-08-18 21:21:49,2015-08-27 18:23:52,,5885998.0,0.0,
17,43549933.0,GEODE-222 Allow redis adapter to handle live entry objects,18.0,109.0,85.0,1.0,1.0,0.0,0.0,2015-08-27 18:24:51,2015-09-02 19:36:06,,5885998.0,1.0,2015-09-02 19:36:06
18,44468833.0,GEODE-313 Improve redis adpater region exception handling,19.0,23.0,21.0,1.0,1.0,1.0,0.0,2015-09-08 18:52:21,2015-09-10 23:08:38,,5885998.0,1.0,2015-09-10 23:08:38
19,47213449.0,GEODE-18 fixing existing header files,20.0,64851.0,25262.0,4337.0,2.0,0.0,0.0,2015-10-08 22:14:18,2015-10-16 22:51:12,,13647469.0,1.0,2015-10-16 22:51:12
20,48381938.0,GEODE-465 Javadocs: Reference to 'PartitionedResolver' should be 'PartitionResolver',21.0,0.0,0.0,0.0,1.0,0.0,0.0,2015-10-21 20:17:16,2015-10-21 23:02:02,Dave Barnes,13138489.0,0.0,
21,48399619.0,GEODE-465 changed 2 occurrences of PartionedResolver to PartitionReso…,22.0,2.0,2.0,2.0,1.0,0.0,0.0,2015-10-21 23:05:20,2015-10-26 23:41:13,Dave Barnes,13138489.0,1.0,2015-10-26 23:41:13
22,48605804.0,GEODE-479 - Updating build.gradle to support Java 8,23.0,2.0,2.0,1.0,1.0,1.0,0.0,2015-10-23 17:14:46,2015-10-26 23:37:10,William Oliveira,163746.0,0.0,
23,48836746.0,Wrong one line build command,24.0,2.0,0.0,1.0,1.0,0.0,0.0,2015-10-27 07:31:26,2015-11-04 18:36:01,Jun Aoki,1417151.0,0.0,
24,48946179.0,Fixes GEODE-495. ,25.0,11.0,5.0,1.0,1.0,0.0,0.0,2015-10-27 23:18:41,2015-10-28 03:43:29,Sai Boorlagadda,7171016.0,0.0,
25,49049497.0,Fixes GEODE-485. ,26.0,5.0,0.0,1.0,1.0,3.0,0.0,2015-10-28 18:43:37,2015-11-06 00:25:55,Sai Boorlagadda,7171016.0,0.0,
26,49074169.0,adding RHEL/CENTOS init scripts for locator and server,27.0,123.0,0.0,2.0,7.0,2.0,0.0,2015-10-28 22:09:11,2015-11-02 18:52:13,,12435996.0,0.0,
27,49325066.0,Javadocs: addGatewayEventFilter() doc correction,28.0,3.0,3.0,3.0,7.0,0.0,0.0,2015-10-30 21:32:34,2015-11-04 18:29:27,Dave Barnes,13138489.0,0.0,
28,49797241.0,[GEODE-252] Remove deprecated PartitionAttributes methods,29.0,12.0,328.0,12.0,2.0,4.0,0.0,2015-11-05 09:00:47,2017-07-25 23:10:55,Roman Shtykh,3435166.0,0.0,
29,49908998.0,GEODE-532 Remove testDefaults in BasicI18nJUnitTest,30.0,0.0,12.0,1.0,1.0,0.0,0.0,2015-11-06 02:23:11,2015-11-06 17:26:13,Roman Shtykh,3435166.0,1.0,2015-11-06 17:26:13
30,49983303.0,GEODE-516: increase the trylock timeout to make sure the deadlock wou…,31.0,1.0,1.0,1.0,1.0,2.0,0.0,2015-11-06 17:46:39,2015-11-06 18:16:39,Jinmei Liao,15638418.0,1.0,2015-11-06 18:16:39
31,50187640.0,GEODE-537 Fix NPE in AFTER_COMPLETION processing during JTA transaction rollback,32.0,42.0,1.0,2.0,1.0,1.0,0.0,2015-11-09 22:29:33,2015-11-10 20:25:11,Sergey Shcherbakov,3210551.0,1.0,2015-11-10 20:25:11
32,50345372.0,Feature/geode 524,33.0,22.0,22.0,7.0,2.0,1.0,0.0,2015-11-11 03:50:40,2015-11-18 19:20:41,Roman Shtykh,3435166.0,1.0,2015-11-18 19:20:41
33,50553242.0,GEODE-543: upgrade the Jline and Spring Shell libraries and fix the c…,34.0,468.0,163.0,13.0,2.0,2.0,0.0,2015-11-12 19:08:05,2015-11-16 21:14:25,Jinmei Liao,15638418.0,0.0,
34,50971657.0,GEODE-331: Update Jetty version in order to avoid security vulnerability,35.0,1.0,1.0,1.0,1.0,3.0,0.0,2015-11-17 16:45:17,2015-11-18 15:58:57,Jinmei Liao,15638418.0,1.0,2015-11-18 15:58:57
35,51005801.0,GEODE-53: Text edit to Geode web pages.,36.0,43.0,44.0,5.0,3.0,1.0,0.0,2015-11-17 21:17:44,2015-11-19 19:33:24,Dave Barnes,13138489.0,0.0,
36,51121794.0,GEODE-390: removing PartitionManager and related tests,37.0,0.0,1009.0,4.0,1.0,1.0,0.0,2015-11-18 18:21:54,2015-12-08 22:24:13,Jinmei Liao,15638418.0,1.0,2015-12-08 22:24:13
37,51154939.0,Update index.html,38.0,14.0,14.0,1.0,1.0,0.0,0.0,2015-11-18 22:50:51,2016-01-26 00:02:34,Greg Chase,7882690.0,0.0,
38,51275399.0,Edits to community/index.html (the Mailing Lists page) and to website…,39.0,10.0,9.0,2.0,1.0,0.0,0.0,2015-11-19 20:22:29,2015-11-20 01:27:11,Dave Barnes,13138489.0,1.0,2015-11-20 01:27:11
39,51420769.0,Feature/geode 53 edit homepage,40.0,15519.0,1048.0,156.0,5.0,1.0,0.0,2015-11-20 23:11:05,2015-11-20 23:14:45,Dave Barnes,13138489.0,0.0,
40,51482449.0,GEODE-18 Add/Update ASF License,41.0,2167.0,34.0,137.0,2.0,2.0,0.0,2015-11-23 02:05:55,2015-11-24 21:00:42,Niall Pemberton,8334575.0,1.0,2015-11-24 21:00:42
41,51562423.0,Reconciled Greg's and Dave's changes to the homepage from PRs #36 and…,42.0,21.0,15.0,1.0,1.0,0.0,0.0,2015-11-23 18:41:27,2015-11-23 20:48:43,Dave Barnes,13138489.0,1.0,2015-11-23 20:48:43
42,51575054.0,"Addresses the documentation component of GEODE-268, adding explanatio…",43.0,5.0,1.0,1.0,2.0,3.0,0.0,2015-11-23 20:24:39,2016-02-10 07:01:06,Dave Barnes,13138489.0,0.0,
43,51704043.0,Fix Spark Connector tutorial links flow,44.0,1.0,1.0,1.0,1.0,1.0,0.0,2015-11-24 19:18:54,2015-11-24 22:12:18,Paweł Antczak,171534.0,1.0,2015-11-24 22:12:17
44,52662502.0,GEODE-341: Refactor Java packages to reflect Apache organization.,45.0,10259.0,0.0,40.0,6.0,0.0,0.0,2015-12-04 12:16:39,2015-12-04 12:32:05,Juan José Ramos,8254001.0,0.0,
45,52663966.0,GEODE-341: Refactor Java packages to reflect Apache organization.,46.0,3005.0,638.0,67.0,1.0,4.0,0.0,2015-12-04 12:33:38,2015-12-07 09:34:20,Juan José Ramos,8254001.0,0.0,
46,52728698.0,"Verified preceding content merges, fixed a couple of typos.",47.0,3.0,3.0,1.0,1.0,0.0,0.0,2015-12-04 22:16:57,2016-01-26 00:02:34,Dave Barnes,13138489.0,0.0,
47,52888971.0,Feature/geode 623,48.0,185.0,17.0,2.0,2.0,0.0,0.0,2015-12-07 19:28:18,2015-12-10 19:42:31,Scott Jewell,13720113.0,0.0,
48,52997487.0,"GEODE-341/ GEODE-628: Refactor Java packages to reflect Apache organization /Rename container folder to ""geode-jvsd""",49.0,130.0,141.0,58.0,2.0,3.0,0.0,2015-12-08 15:49:37,2016-01-13 17:14:41,Juan José Ramos,8254001.0,1.0,2016-01-13 17:14:41
49,53190308.0,Fixes Geode 644: DataAsAddress needs better unit test coverage,50.0,593.0,43.0,4.0,3.0,0.0,0.0,2015-12-09 22:49:31,2015-12-10 19:40:49,Sai Boorlagadda,7171016.0,0.0,
50,53306887.0,Feature/geode 624,51.0,378.0,72.0,4.0,4.0,0.0,0.0,2015-12-10 19:46:14,2015-12-10 22:24:45,Scott Jewell,13720113.0,0.0,
51,53334792.0,GEM-164: move the security tests in gemfire-test module inside the co…,52.0,8988.0,0.0,47.0,1.0,2.0,0.0,2015-12-10 23:44:12,2015-12-11 16:55:09,Jinmei Liao,15638418.0,0.0,
52,53336072.0,Additional offheap test coverage based on jira ticket GEODE-624,53.0,374.0,72.0,4.0,5.0,0.0,0.0,2015-12-10 23:59:50,2015-12-11 21:42:34,Scott Jewell,13720113.0,0.0,
53,53418889.0,Feature/gem 164: move security tests from closed to open and remove pivotal license and use ASF license,54.0,9309.0,1.0,48.0,1.0,1.0,0.0,2015-12-11 17:12:41,2015-12-11 23:34:33,Jinmei Liao,15638418.0,0.0,
54,53421602.0,GEODE-655 Website sentence needs improvement,55.0,1.0,1.0,1.0,1.0,1.0,0.0,2015-12-11 17:37:37,2015-12-15 17:44:05,Karen Miller,13498674.0,1.0,2015-12-15 17:44:05
55,53426856.0,Feature/gem 164: move security tests from closed to open and remove pivotal license and use ASF license,56.0,472.0,169.0,15.0,1.0,0.0,0.0,2015-12-11 18:27:41,2015-12-11 18:28:25,Jinmei Liao,15638418.0,0.0,
56,53427107.0,GEODE-543: upgrade the Jline and Spring Shell libraries and fix the c…,57.0,472.0,169.0,15.0,1.0,0.0,0.0,2015-12-11 18:30:04,2015-12-21 17:39:11,Jinmei Liao,15638418.0,0.0,
57,53457937.0,Feature/geode 663: adding more security test code into open source,58.0,9324.0,1.0,48.0,2.0,2.0,0.0,2015-12-11 23:36:06,2015-12-21 17:24:52,Jinmei Liao,15638418.0,0.0,
58,53637166.0,GEODE-568: wait at most 5 seconds before checking the size of the int…,59.0,7.0,4.0,1.0,1.0,0.0,0.0,2015-12-14 23:15:27,2015-12-17 18:35:31,Jinmei Liao,15638418.0,1.0,2015-12-17 18:35:31
59,53773771.0,GEODE-651: Chunk classes need unit tests,60.0,1223.0,1.0,6.0,6.0,1.0,10.0,2015-12-15 22:44:10,2015-12-16 00:53:25,Sai Boorlagadda,7171016.0,0.0,
60,53914944.0,GEODE-680: Chunk refactoring encountered while writing unit tests.,61.0,23.0,26.0,2.0,1.0,1.0,0.0,2015-12-16 23:34:58,2015-12-17 22:28:00,Sai Boorlagadda,7171016.0,0.0,
61,54155981.0,SimpleMemoryAllocatorJUnitTest.testClose - Disabled it until it is fixed,62.0,6.0,1.0,1.0,2.0,3.0,0.0,2015-12-18 22:13:32,2015-12-19 00:15:09,Sai Boorlagadda,7171016.0,0.0,
62,54159863.0,GEODE-568: SharedConfiguration region scope needs to be DISTRIBUTED_A…,63.0,1.0,0.0,1.0,1.0,1.0,0.0,2015-12-18 23:01:53,2015-12-21 16:51:03,Jinmei Liao,15638418.0,0.0,
63,54389394.0,GEODE-649: add more logging to see the reason of future failure.,64.0,3.0,1.0,2.0,1.0,0.0,0.0,2015-12-22 16:39:53,2015-12-22 18:57:30,Jinmei Liao,15638418.0,0.0,
64,54421651.0,"GEODE-574: for --ciphers and --protocols options, if the value is ""an…",65.0,6.0,4.0,1.0,1.0,0.0,0.0,2015-12-22 22:19:45,2016-01-06 17:19:57,Jinmei Liao,15638418.0,0.0,
65,54693169.0,Enabling direct reporting on Geode's website,66.0,2.0,0.0,1.0,1.0,0.0,0.0,2015-12-28 23:58:47,2016-03-30 05:08:30,Roman V Shaposhnik,34680.0,0.0,
66,55236801.0,GEODE-401: upgrade log4j from 2.1 to 2.5. Remove our own configuratio…,67.0,4.0,547.0,7.0,1.0,1.0,0.0,2016-01-06 17:03:57,2016-01-08 00:31:38,Jinmei Liao,15638418.0,0.0,
67,55271196.0,GEODE-712: Move junit asserts out of finally block,68.0,2.0,2.0,1.0,1.0,1.0,0.0,2016-01-06 22:02:18,2016-01-06 23:33:15,Scott Jewell,13720113.0,0.0,
68,55408750.0,GEODE-769  Update 3 issues in README.md,69.0,4.0,2.0,1.0,1.0,1.0,0.0,2016-01-08 00:03:45,2016-01-08 00:36:14,Karen Miller,13498674.0,0.0,
69,55823866.0,Feature/geode 12,70.0,137713.0,207897.0,1950.0,456.0,1.0,0.0,2016-01-12 22:01:42,2016-01-21 22:54:58,Jinmei Liao,15638418.0,0.0,
70,56051612.0,GEODE-342: Make changes to Geode gradle build script to also build JVSD,71.0,132.0,219.0,6.0,2.0,5.0,0.0,2016-01-14 15:44:07,2016-02-18 14:16:17,Juan José Ramos,8254001.0,0.0,
71,56397545.0,GEODE-601: Fix intermittent exception in DiskRegionJUnitTest.,72.0,66.0,115.0,4.0,1.0,1.0,0.0,2016-01-18 22:11:45,2016-01-19 23:02:18,Shreedhar Hardikar,2496677.0,0.0,
72,56541558.0,GEODE-749: refactor the code to look for the war file in multiple pla…,73.0,61.0,93.0,5.0,2.0,0.0,0.0,2016-01-19 23:20:11,2016-01-21 18:44:46,Jinmei Liao,15638418.0,0.0,
73,56670380.0,Added cache to FunctionalContextImpl,74.0,60.0,44.0,15.0,1.0,1.0,0.0,2016-01-20 21:32:49,2017-06-29 21:20:19,Shreedhar Hardikar,2496677.0,0.0,
74,56918619.0,GEODE-12: license file update,75.0,157.0,9.0,3.0,2.0,0.0,0.0,2016-01-22 17:42:48,2016-01-22 22:27:05,Jinmei Liao,15638418.0,0.0,
75,56992417.0,Update Events section of Geode Community website,76.0,14.0,26.0,1.0,3.0,0.0,0.0,2016-01-24 01:43:29,2016-01-25 20:01:28,Dave Barnes,13138489.0,0.0,
76,57111666.0,Feature/geode 735,77.0,128403.0,3393.0,580.0,83.0,2.0,0.0,2016-01-25 18:39:20,2016-01-26 17:47:06,Kenneth Howe,16668768.0,0.0,
77,57168750.0,GEODE-854: refactor gemfire-pulse not to generate a pulseverion.prope…,78.0,30.0,148.0,4.0,1.0,2.0,0.0,2016-01-26 04:22:39,2016-01-26 15:54:15,Jinmei Liao,15638418.0,0.0,
78,57289164.0,GEODE-735: Create JUnit tests for OffHeapHelper,79.0,314.0,0.0,1.0,1.0,1.0,0.0,2016-01-26 23:17:12,2016-01-28 19:36:24,Kenneth Howe,16668768.0,0.0,
79,57392572.0,GEODE-852: refactor gemfire-pulse not to generate a pulseverion.prope…,80.0,22.0,69.0,3.0,2.0,3.0,0.0,2016-01-27 17:20:28,2016-01-27 18:28:44,Jinmei Liao,15638418.0,0.0,
80,57404207.0,GEODE-852: copyPulsePropFile needs to make sure gemfire-core builds f…,81.0,1.0,0.0,1.0,1.0,0.0,0.0,2016-01-27 18:47:04,2016-01-28 18:10:01,Jinmei Liao,15638418.0,0.0,
81,57682669.0,Fixes GEODE-874,82.0,12.0,12.0,5.0,1.0,3.0,0.0,2016-01-29 18:14:09,2016-02-01 15:58:44,Kenneth Howe,16668768.0,0.0,
82,57710036.0,GEODE-646: OffHeapRegionEntryHelper needs unit test,83.0,892.0,29.0,3.0,2.0,1.0,0.0,2016-01-29 22:10:48,2016-02-01 23:33:05,Sai Boorlagadda,7171016.0,0.0,
83,57764636.0,Fix footer GitHub link,84.0,1.0,1.0,1.0,1.0,0.0,0.0,2016-01-31 09:50:46,2016-01-31 10:19:11,John C Bledsoe,59550.0,1.0,2016-01-31 10:19:11
84,57792925.0,[GEODE-884] Update README.md to include steps to build without running tests,85.0,1.0,1.0,1.0,1.0,1.0,0.0,2016-02-01 03:25:08,2016-03-25 22:40:07,Deleted user,10137.0,0.0,
85,57879828.0,GEODE-887: correct paths in README.md,86.0,2.0,2.0,1.0,1.0,0.0,0.0,2016-02-01 18:30:17,2016-02-10 23:17:31,Kenneth Howe,16668768.0,0.0,
86,58051172.0,GEODE-893: CI failure: LauncherLifecycleCommandsJUnitTest.testGetSpringJars,87.0,2.0,2.0,1.0,1.0,0.0,0.0,2016-02-02 21:15:52,2016-02-02 21:23:38,Sai Boorlagadda,7171016.0,1.0,2016-02-02 21:23:38
87,58171302.0,Update committers' list,88.0,1.0,0.0,1.0,1.0,0.0,0.0,2016-02-03 17:27:03,2016-02-04 16:17:17,Dave Barnes,13138489.0,1.0,2016-02-04 16:17:17
88,58472279.0,Geode 891: DataType needs better unit test coverage,89.0,301.0,22.0,2.0,2.0,2.0,0.0,2016-02-05 19:21:54,2016-02-06 00:41:00,Sai Boorlagadda,7171016.0,0.0,
89,58497156.0,Build PR 88: Update committers' list,90.0,6815.0,0.0,28.0,1.0,1.0,0.0,2016-02-05 23:05:41,2016-02-10 17:33:00,Dave Barnes,13138489.0,0.0,
90,58686016.0,GEODE-909: CI failure: MemoryThresholdsOffHeapDUnitTest.testDisabledThresholds,91.0,3.0,5.0,1.0,1.0,2.0,0.0,2016-02-08 23:50:39,2016-02-09 19:07:50,Sai Boorlagadda,7171016.0,0.0,
91,58822745.0,GEODE-557: CI failure: MemoryThresholdsOffHeapDUnitTest.testDistributedRegionRemotePutRejectionCacheClose,92.0,3.0,5.0,1.0,1.0,1.0,0.0,2016-02-09 22:58:29,2016-02-10 00:06:25,Sai Boorlagadda,7171016.0,0.0,
92,59097826.0,"Modify README.md: Update most occurrences of ""Geode"" to ""Apache Geode"".",93.0,6.0,6.0,1.0,2.0,2.0,0.0,2016-02-11 21:38:57,2016-02-25 22:53:13,Dave Barnes,13138489.0,0.0,
93,59537837.0,GEODE-901: Remove invalid source headers,94.0,0.0,14.0,2.0,1.0,2.0,0.0,2016-02-16 19:06:12,2016-02-16 21:12:37,Sai Boorlagadda,7171016.0,1.0,2016-02-16 21:12:37
94,59581150.0,GEODE-903 Update Copyright,95.0,1.0,1.0,1.0,1.0,1.0,0.0,2016-02-17 01:01:43,2016-02-22 22:28:29,Joey McAllister,16106577.0,1.0,2016-02-22 22:28:29
95,59697571.0,GEODE-876: Add a README file to the binary distribution,96.0,2.0,8.0,2.0,2.0,3.0,0.0,2016-02-17 19:43:43,2016-02-24 22:46:43,Sai Boorlagadda,7171016.0,0.0,
96,59713184.0,Feature/geode 855,97.0,281.0,0.0,1.0,7.0,3.0,0.0,2016-02-17 21:40:22,2016-02-18 15:13:49,Kenneth Howe,16668768.0,0.0,
97,59845679.0,GEODE-866: Converting calls of vm.invoke to lambdas,98.0,18843.0,25132.0,311.0,12.0,6.0,0.0,2016-02-18 18:55:35,2016-02-19 18:36:49,Dan Smith,857521.0,1.0,2016-02-19 18:36:49
98,59986021.0,Fix typos in gfsh help. [fixes #114105869]. [fixes Geode-984],99.0,4.0,4.0,1.0,1.0,1.0,0.0,2016-02-19 18:13:34,2016-02-22 17:33:42,Dave Barnes,13138489.0,1.0,2016-02-22 17:33:42
99,59988416.0,GEODE-52: Remove @author tags from Java source,100.0,75498.0,4102.0,3517.0,2.0,4.0,3.0,2016-02-19 18:33:28,2016-03-14 21:46:15,Sai Boorlagadda,7171016.0,0.0,
100,60240597.0,GEODE-906: Clean up source header / modification text,101.0,8.0,18.0,3.0,1.0,1.0,0.0,2016-02-22 21:05:38,2016-02-24 00:09:28,Sai Boorlagadda,7171016.0,0.0,
101,60391238.0,Feature/geode 856,102.0,435.0,0.0,1.0,24.0,1.0,0.0,2016-02-23 19:03:16,2016-02-23 19:59:05,Kenneth Howe,16668768.0,0.0,
102,60401009.0,GEODE-856: New unit test class for covering MemoryBlockNode,103.0,435.0,0.0,1.0,1.0,0.0,0.0,2016-02-23 20:06:30,2016-02-23 22:37:56,Kenneth Howe,16668768.0,0.0,
103,60416241.0,Add Sai Boorlagadda to committers' list,104.0,1.0,0.0,1.0,1.0,0.0,0.0,2016-02-23 21:51:39,2016-02-23 22:42:47,Dave Barnes,13138489.0,0.0,
104,60427051.0,Applied pr #105 : update compiled community page,105.0,1.0,0.0,1.0,1.0,2.0,0.0,2016-02-23 23:08:58,2016-03-02 18:56:37,Dave Barnes,13138489.0,0.0,
105,60599909.0,Update website build instructions - replace deprecated 'nanoc autocom…,106.0,12.0,8.0,1.0,1.0,0.0,0.0,2016-02-24 23:44:18,2016-03-30 04:54:10,Dave Barnes,13138489.0,1.0,2016-03-30 04:54:10
106,60770706.0,Updating README,107.0,12.0,4.0,1.0,1.0,0.0,0.0,2016-02-26 00:07:27,2016-03-11 23:16:17,Swapnil Bawaskar,1129281.0,0.0,
107,61107971.0,Feature/geode 856.1,108.0,246.0,2.0,2.0,2.0,0.0,0.0,2016-02-29 16:51:50,2016-03-01 18:46:58,Kenneth Howe,16668768.0,0.0,
108,61851464.0,GEODE-36 Interim fix to display correct product name on gfsh cli,109.0,1.0,1.0,1.0,1.0,1.0,0.0,2016-03-06 19:09:32,2016-03-07 15:44:13,Nitin Lamba,14815419.0,0.0,
109,62119917.0,GEODE-511 Residual 'Gemfire' fixed to Geode in Pulse,110.0,4.0,4.0,2.0,3.0,3.0,0.0,2016-03-08 19:10:50,2016-03-08 19:21:55,Nitin Lamba,14815419.0,0.0,
110,62127952.0,GEODE-511 Pulse: Residual 'Gemfire' changed to 'Geode',111.0,4.0,4.0,2.0,1.0,4.0,0.0,2016-03-08 20:05:32,2016-03-25 22:43:09,Nitin Lamba,14815419.0,0.0,
111,62588429.0,GEODE-247: Fix in executeQuery function to use the bucket parameter a…,112.0,433.0,47.0,5.0,6.0,1.0,12.0,2016-03-11 19:12:30,2016-03-17 20:41:29,Nabarun Nag,8689859.0,0.0,
112,62975921.0,Geode-54: missing javadocs,113.0,52.0,39.0,7.0,4.0,2.0,0.0,2016-03-15 20:59:02,2016-03-17 01:00:56,Dave Barnes,13138489.0,0.0,
113,63080826.0,GEODE-874: Place all build-from-source instructions into file BUILDIN…,114.0,73.0,54.0,4.0,2.0,5.0,1.0,2016-03-16 15:12:03,2016-03-25 22:40:07,Karen Miller,13498674.0,0.0,
114,63126250.0,Geode-54: missing javadocs,115.0,242.0,19.0,4.0,3.0,2.0,0.0,2016-03-16 19:58:42,2016-03-17 00:00:26,Dave Barnes,13138489.0,0.0,
115,63306356.0,GEODE-247: Fix in executeQuery function to use the bucket parameter,116.0,208.0,47.0,4.0,1.0,1.0,0.0,2016-03-17 23:05:35,2016-03-17 23:51:39,Nabarun Nag,8689859.0,0.0,
116,63313350.0,GEODE-247: Fix in executeQuery function to use the bucket parameter ,117.0,201.0,48.0,4.0,1.0,0.0,0.0,2016-03-18 00:34:16,2016-03-22 17:52:26,Nabarun Nag,8689859.0,0.0,
117,64544230.0,GEODE-1145 Fix decimal places for LoadAvg on Pulse,118.0,9.0,6.0,4.0,1.0,1.0,0.0,2016-03-29 22:24:57,2016-03-31 15:29:46,Nitin Lamba,14815419.0,0.0,
118,64688793.0,"GEODE-1142: Modified the cleanUpVM function to clear all directories, fixed cleanDiskDir.",119.0,12.0,9.0,2.0,1.0,0.0,0.0,2016-03-30 20:10:00,2016-03-31 21:23:51,Nabarun Nag,8689859.0,0.0,
119,64712507.0,GEODE-1151 Add new committer to list on web page,120.0,5.0,3.0,1.0,2.0,1.0,0.0,2016-03-30 23:15:10,2016-04-06 00:21:43,Karen Miller,13498674.0,0.0,
120,64979449.0,GEODE-1061: Made the update operations to be synchronous and made sure executeCQ happens before updates,121.0,10.0,21.0,2.0,1.0,0.0,0.0,2016-04-01 17:41:27,2016-04-05 21:37:07,Nabarun Nag,8689859.0,0.0,
121,65031242.0,GEODE-1163 Fix branding in Swagger UI,122.0,15.0,6.0,2.0,3.0,4.0,0.0,2016-04-02 07:44:15,2016-04-09 04:19:25,Nitin Lamba,14815419.0,0.0,
122,65204910.0,GEODE-1018: Added a listener to make the receiver go to sleep on AfterCreate event to solve timing issue.,123.0,28.0,24.0,2.0,2.0,0.0,0.0,2016-04-04 20:09:35,2016-04-05 21:38:34,Nabarun Nag,8689859.0,0.0,
123,65237830.0,GEODE-904 Adds file listings to LICENSE,124.0,131.0,70.0,1.0,1.0,2.0,1.0,2016-04-05 01:18:29,2016-04-06 16:59:45,Joey McAllister,16106577.0,0.0,
124,65671245.0,GEODE-235: Add region name to EntryEventImpl.toString,125.0,74.0,1.0,2.0,5.0,1.0,0.0,2016-04-07 17:49:56,2016-04-12 18:32:59,Scott Jewell,13720113.0,0.0,
125,65734272.0,Feature/geode 904,126.0,995.0,369.0,2.0,12.0,2.0,0.0,2016-04-08 04:05:33,2016-04-08 19:55:15,Joey McAllister,16106577.0,0.0,
126,66222359.0,GEODE-1125: Introduced awaitility to make the receiver wait in order to receive the new puts from the sender.,127.0,106.0,37.0,1.0,1.0,0.0,0.0,2016-04-12 20:27:43,2016-04-18 17:24:09,Nabarun Nag,8689859.0,0.0,
127,66392588.0,"GEODE-1032 : Placed additional wait time to check for empty queue, refactored WANTestBase.java to remove unused functions, replaced wait criterions with awaitility.",128.0,569.0,2040.0,37.0,1.0,0.0,0.0,2016-04-13 21:13:31,2016-04-18 17:40:49,Nabarun Nag,8689859.0,0.0,
128,66549012.0,GEODE-1190: LuceneServiceProvider.get now accepts GemFireCache as a parameter.,129.0,47.0,30.0,2.0,1.0,0.0,0.0,2016-04-14 20:32:39,2016-04-18 22:37:54,Nabarun Nag,8689859.0,0.0,
129,66591525.0,UDA functionality for OQL engine of Geode,130.0,2824.0,840.0,57.0,4.0,5.0,0.0,2016-04-15 05:19:35,2017-07-25 23:10:55,Asif,12415848.0,0.0,
130,67220140.0,GEODE-1258: Added tests for WAN authentication.,131.0,326.0,0.0,2.0,1.0,1.0,0.0,2016-04-20 16:42:22,2016-04-27 23:39:07,Nabarun Nag,8689859.0,0.0,
131,67228207.0,GEODE-1059: PRQueryDUnitHelper no longer inherits PartitionedRegionDUnitTestCase,132.0,805.0,1993.0,24.0,1.0,0.0,0.0,2016-04-20 17:39:38,2016-04-27 23:39:07,Nabarun Nag,8689859.0,0.0,
132,67391177.0,GEODE-935: Removed the sleeps to speed up tests.,133.0,0.0,4.0,1.0,1.0,1.0,0.0,2016-04-21 17:20:23,2016-04-27 23:39:07,Nabarun Nag,8689859.0,0.0,
133,67392219.0,GEODE-710: Replaced thread.sleep with Awaitility,134.0,7.0,3.0,1.0,1.0,0.0,0.0,2016-04-21 17:28:09,2016-04-27 23:39:07,Nabarun Nag,8689859.0,0.0,
134,67556299.0,ReferenceCountHelper junit tests for GEODE-656,135.0,1546.0,158.0,4.0,1.0,1.0,0.0,2016-04-22 18:51:26,2016-05-04 23:51:09,Scott Jewell,13720113.0,0.0,
135,67578114.0,GEODE-1288: Correct entry expiration detection logic error,136.0,66.0,71.0,1.0,3.0,2.0,0.0,2016-04-22 21:52:20,2016-05-04 22:30:43,Scott Jewell,13720113.0,0.0,
136,67755688.0,GEODE-1262: Removed VM5-VM7 in AsyncEventQueueTestBase,137.0,732.0,754.0,5.0,1.0,1.0,0.0,2016-04-25 17:16:33,2016-04-27 23:53:20,Nabarun Nag,8689859.0,0.0,
137,67957426.0,Feature/geode 1278,138.0,169.0,4.0,3.0,3.0,1.0,0.0,2016-04-26 21:00:34,2016-05-04 21:29:19,Kenneth Howe,16668768.0,0.0,
138,68747930.0,GEODE-1121: Increased the max memory in the sender,139.0,19.0,15.0,4.0,1.0,1.0,0.0,2016-05-03 17:59:29,2016-05-24 20:15:25,Nabarun Nag,8689859.0,0.0,
139,68944426.0,GEODE-1028: Fix broken link on website's Releases page,140.0,1.0,1.0,1.0,1.0,1.0,0.0,2016-05-04 22:49:11,2016-05-04 23:38:06,Karen Miller,13498674.0,0.0,
140,69046440.0,GEODE-1340: Refactored the names of lucene integration tests.,141.0,16.0,6.0,4.0,1.0,1.0,0.0,2016-05-05 18:16:21,2016-05-09 19:09:19,Nabarun Nag,8689859.0,0.0,
141,69743803.0,GEODE-1224:  AttributesMutator.setCloningEnabled does not modify PR bucket regions,142.0,182.0,13.0,4.0,5.0,1.0,0.0,2016-05-11 21:16:09,2016-05-11 22:30:16,Scott Jewell,13720113.0,0.0,
142,70270564.0,Feature/geode 1256,143.0,2.0,1.0,2.0,2.0,1.0,0.0,2016-05-16 22:12:43,2016-05-17 00:34:29,Karen Miller,13498674.0,0.0,
143,70287489.0,GEODE-1256  Alter rat.gradle to exclude copies of website sources,144.0,1.0,0.0,1.0,1.0,3.0,0.0,2016-05-17 01:30:00,2016-05-17 17:26:08,Karen Miller,13498674.0,0.0,
144,70403239.0,GEODE-1296: change conditional in getRawBytes to assert,145.0,35.0,12.0,3.0,3.0,4.0,3.0,2016-05-17 18:08:15,2016-05-25 22:08:20,Kenneth Howe,16668768.0,0.0,
145,71265864.0,GEODE-1413: Replaced wait with awaitility clause on receiver regionSize,146.0,8.0,3.0,1.0,1.0,1.0,0.0,2016-05-24 18:03:53,2016-05-24 23:14:42,Nabarun Nag,8689859.0,0.0,
146,71285185.0,GEODE-1121: Reduced the memory configurations in the overflow tests.,147.0,19.0,15.0,4.0,1.0,1.0,0.0,2016-05-24 20:15:35,2016-05-24 23:14:42,Nabarun Nag,8689859.0,0.0,
147,71305373.0,GEODE-748: Unexpected version string returned from gfsh,148.0,12.0,16.0,2.0,2.0,2.0,0.0,2016-05-24 22:46:06,2016-05-26 16:43:50,Kevin Duling,5323097.0,0.0,
148,71588273.0,GEODE-1331: gfsh.bat on Windows is incorrect,149.0,16.0,17.0,1.0,2.0,0.0,2.0,2016-05-26 16:48:18,2016-06-06 16:06:25,Kevin Duling,5323097.0,0.0,
149,72226439.0,Feature/geode 308,150.0,23.0,1364.0,11.0,3.0,2.0,0.0,2016-06-01 18:09:04,2016-06-03 21:19:06,Kevin Duling,5323097.0,0.0,
