,pr_id,pr_title,pr_number,additions,deletions,pr_changed_files,pr_commits_count,pr_comments_count,pr_review_comments_count,pr_created_at,pr_closed_at,contributor,contributor_id,is_merged,pr_merged_at
435,345900235.0,Remove all formatting only and any other unrelated diffs between mast…,673.0,1196.0,367.0,42.0,1.0,0.0,0.0,2019-11-26 19:31:30,2019-11-26 20:11:11,Samarth Jain,1642180.0,1.0,2019-11-26 20:11:11
436,346261382.0,[WIP]Supports spark-3.0 data source V2 APIs,674.0,1060.0,708.0,19.0,1.0,5.0,28.0,2019-11-27 14:13:17,2019-12-11 01:21:02,"Chen, Junjie",3960228.0,0.0,
437,347130552.0,Inherit snapshot ids for manifest entries,675.0,1230.0,200.0,33.0,1.0,15.0,101.0,2019-11-29 18:01:36,2020-02-03 22:53:51,Anton Okolnychyi,6235869.0,1.0,2020-02-03 22:53:51
438,347320367.0,Remove some of the unused variables,676.0,1.0,13.0,5.0,2.0,0.0,2.0,2019-12-01 11:42:47,2019-12-09 17:41:42,Fokko Driesprong,1134248.0,1.0,2019-12-09 17:41:42
439,347320387.0,Fix MissingOverride error,677.0,1.0,0.0,1.0,1.0,1.0,0.0,2019-12-01 11:43:11,2019-12-02 18:34:42,Fokko Driesprong,1134248.0,1.0,2019-12-02 18:34:42
440,347640896.0,Add Java code examples and update site docs,678.0,1116.0,7.0,14.0,17.0,11.0,46.0,2019-12-02 14:03:56,2020-04-09 03:20:45,,32553472.0,1.0,2020-04-09 03:20:45
441,348300644.0,[WIP] [ISSUE #672] Add namespace metadata ,679.0,592.0,0.0,6.0,1.0,3.0,0.0,2019-12-03 12:25:22,2019-12-27 23:14:26,XiaokunDing,3050222.0,0.0,
442,348730543.0,[ISSUE #680] Fix the listTable in HadoopCatalog,681.0,7.0,2.0,2.0,3.0,4.0,6.0,2019-12-04 07:13:30,2019-12-18 19:36:30,XiaokunDing,3050222.0,1.0,2019-12-18 19:36:30
443,349027558.0,Add quick build option to disable checkstyle and error-prone,685.0,25.0,19.0,2.0,1.0,2.0,0.0,2019-12-04 18:18:42,2019-12-05 15:35:59,Ryan Blue,87915.0,1.0,2019-12-05 15:35:59
444,349085390.0,Add transform expressions,686.0,901.0,180.0,30.0,8.0,5.0,16.0,2019-12-04 20:47:07,2019-12-18 17:58:31,Ryan Blue,87915.0,1.0,2019-12-18 17:58:31
445,349308090.0,[ISSUE  #672] Add SupportsNamespaces for 'HadoopCatalog' and 'HiveCatalog',687.0,673.0,0.0,12.0,2.0,0.0,0.0,2019-12-05 08:08:54,2019-12-05 08:54:48,XiaokunDing,3050222.0,0.0,
446,349325234.0,[ISSUE #672] Add SupportsNamespaces for 'HadoopCatalog' and 'HiveCatalog',688.0,5.0,45.0,10.0,1.0,7.0,195.0,2019-12-05 08:57:51,2020-04-12 06:48:07,XiaokunDing,3050222.0,0.0,
447,349649815.0,Add compression level,689.0,23.0,0.0,2.0,1.0,0.0,0.0,2019-12-05 21:18:14,2019-12-06 14:03:22,Ryan Blue,87915.0,1.0,2019-12-06 14:03:22
448,349682705.0,Shading Arrow dependencies ,690.0,112.0,8.0,8.0,3.0,2.0,3.0,2019-12-05 22:51:47,2019-12-11 20:38:32,Gautam,1474591.0,1.0,2019-12-11 20:38:32
449,350336199.0,Add Spark Avro JMH tests,694.0,276.0,2.0,5.0,1.0,2.0,3.0,2019-12-07 18:46:34,2019-12-09 17:40:02,Shardul Mahadik,6961317.0,1.0,2019-12-09 17:40:02
450,351290552.0,Cherrypick snapshot feature,695.0,1188.0,50.0,18.0,40.0,19.0,101.0,2019-12-10 09:40:33,2020-02-04 21:49:57,Gautam,1474591.0,1.0,2020-02-04 21:49:57
451,351964030.0,[spark-3]Fix build issue and one import issue,696.0,7.0,12.0,5.0,2.0,2.0,5.0,2019-12-11 15:11:17,2019-12-13 00:59:38,"Chen, Junjie",3960228.0,1.0,2019-12-13 00:59:38
452,352473581.0,Add missing table properties to configuration.md,699.0,6.0,1.0,1.0,1.0,1.0,1.0,2019-12-12 15:29:46,2019-12-13 00:58:08,Anton Okolnychyi,6235869.0,1.0,2019-12-13 00:58:08
453,353918901.0,Fix NullPointerException when message isn't included with exception,701.0,1.0,1.0,1.0,1.0,1.0,0.0,2019-12-17 05:22:40,2019-12-18 19:25:54,Chris Wiens,10886716.0,1.0,2019-12-18 19:25:54
454,354005484.0,Refactor code and change dependencies,702.0,217.0,255.0,27.0,1.0,0.0,0.0,2019-12-17 09:37:58,2019-12-17 21:15:45,Samarth Jain,1642180.0,1.0,2019-12-17 21:15:45
455,354365814.0,StructType#indexFields() breaks when schema contains column names which differ only by case,703.0,29.0,17.0,2.0,1.0,1.0,0.0,2019-12-18 00:07:35,2019-12-18 19:29:37,Ratandeep Ratti,129474.0,1.0,2019-12-18 19:29:37
456,354642485.0,"[ISSUE #672] Add SupportsNamespaces for 'HadoopCatalog' , 'HiveCatalog' and 'SparkCatalog'",704.0,1196.0,5.0,18.0,3.0,2.0,0.0,2019-12-18 14:29:51,2020-04-09 19:37:40,XiaokunDing,3050222.0,0.0,
457,354728739.0,Add session catalog for Spark 3.0,705.0,250.0,12.0,5.0,5.0,9.0,6.0,2019-12-18 17:29:28,2019-12-23 17:07:33,Ryan Blue,87915.0,1.0,2019-12-23 17:07:33
458,354838147.0,Add DeleteFrom support for Spark 3.0,706.0,23.0,2.0,2.0,5.0,2.0,4.0,2019-12-18 22:01:38,2019-12-30 17:54:29,Ryan Blue,87915.0,1.0,2019-12-30 17:54:29
459,354975072.0,Enable a path for consuming applications to not reuse underlying arrow buffers.,707.0,61.0,98.0,11.0,1.0,0.0,0.0,2019-12-19 06:41:46,2019-12-19 19:13:49,Samarth Jain,1642180.0,1.0,2019-12-19 19:13:49
460,355767425.0,Bump Apache Parquet to 1.11.0,708.0,44.0,24.0,4.0,7.0,23.0,7.0,2019-12-20 15:03:49,2020-01-28 17:50:47,Fokko Driesprong,1134248.0,1.0,2020-01-28 17:50:47
461,356034855.0,Merging master into vectorized-read,709.0,1452.0,305.0,61.0,206.0,0.0,0.0,2019-12-21 22:11:02,2019-12-23 17:08:18,Samarth Jain,1642180.0,1.0,2019-12-23 17:08:18
462,356035303.0,Parquet changes for vectorized reads,710.0,549.0,146.0,8.0,6.0,1.0,31.0,2019-12-21 22:15:51,2019-12-30 17:50:01,Samarth Jain,1642180.0,1.0,2019-12-30 17:50:01
463,356225829.0,[ISSUE #711] Fix the escape quote character while find table in hive catalog,712.0,8.0,2.0,1.0,1.0,3.0,0.0,2019-12-23 07:58:57,2020-01-23 18:29:31,XiaokunDing,3050222.0,0.0,
464,356343498.0,[ISSUE #714] Add alterTable testUtil And Fix partition error message,716.0,14.0,3.0,3.0,2.0,6.0,2.0,2019-12-23 14:13:16,2020-03-13 23:01:04,XiaokunDing,3050222.0,0.0,
465,356581585.0,Update projection in addedFiles to support appending,718.0,76.0,2.0,3.0,2.0,0.0,4.0,2019-12-24 09:39:01,2019-12-30 17:53:46,"Chen, Junjie",3960228.0,1.0,2019-12-30 17:53:46
466,356862081.0,Route to Hadoop table more strictly in IcebergSource#getTable(),719.0,7.0,1.0,1.0,1.0,1.0,2.0,2019-12-26 03:32:19,2019-12-30 17:51:19,Xiang Li,13976495.0,0.0,
467,357196884.0,Add missing overrides,720.0,4.0,0.0,4.0,1.0,1.0,0.0,2019-12-27 10:41:22,2019-12-27 18:22:29,Fokko Driesprong,1134248.0,1.0,2019-12-27 18:22:29
468,358333968.0,Add PreferredLocations support for Iceberg Spark Source,721.0,61.0,2.0,1.0,3.0,1.0,14.0,2019-12-31 11:00:23,2020-01-23 18:06:04,Saisai Shao,850797.0,1.0,2020-01-23 18:06:04
469,358674285.0,Remove warnings from the build,722.0,10.0,19.0,2.0,3.0,2.0,6.0,2020-01-02 14:20:47,2020-01-15 17:18:29,Fokko Driesprong,1134248.0,1.0,2020-01-15 17:18:29
470,358786722.0,Arrow changes for supporting vectorized reads,723.0,3677.0,220.0,24.0,10.0,2.0,113.0,2020-01-02 20:38:22,2020-03-04 01:13:48,Samarth Jain,1642180.0,1.0,2020-03-04 01:13:48
471,359684584.0,Add links to the issues@ list.  Add a more complete description of the private@ list,724.0,6.0,2.0,1.0,2.0,0.0,3.0,2020-01-06 19:43:35,2020-01-07 00:42:28,Jakob Homan,95350.0,1.0,2020-01-07 00:42:28
472,359865270.0,Fix api java doc errors.,725.0,2.0,2.0,1.0,1.0,1.0,0.0,2020-01-07 07:39:22,2020-01-07 18:38:40,,12246263.0,1.0,2020-01-07 18:38:40
473,360130466.0,Fix for #245,727.0,1.0,0.0,1.0,1.0,3.0,0.0,2020-01-07 19:10:07,2020-01-08 17:36:06,Nick Childers,889215.0,0.0,
474,360515140.0,Update GenericDataFile to return ByteBuffer for keyMetadata in get,728.0,1.0,1.0,1.0,1.0,1.0,0.0,2020-01-08 15:29:30,2020-01-15 01:38:52,Anton Okolnychyi,6235869.0,1.0,2020-01-15 01:38:52
475,361809257.0,HIVE: On alter table prevent hive from recursively scanning the complete table dir,734.0,7.0,1.0,1.0,3.0,11.0,2.0,2020-01-12 09:02:41,2020-01-15 01:37:25,,45828782.0,1.0,2020-01-15 01:37:25
476,362269797.0,Refactor FilteredManifest and ManifestGroup,735.0,117.0,124.0,6.0,5.0,6.0,24.0,2020-01-13 18:54:40,2020-01-27 18:32:15,Ratandeep Ratti,129474.0,1.0,2020-01-27 18:32:15
477,363188845.0,Add timeout for acquiring locks in HiveTableOperations,736.0,25.0,3.0,1.0,2.0,3.0,6.0,2020-01-15 15:15:11,2020-01-16 17:08:05,Xiang Li,13976495.0,1.0,2020-01-16 17:08:05
478,363389866.0,schema evolution support,737.0,28.0,21.0,5.0,1.0,0.0,0.0,2020-01-15 23:48:25,2020-01-16 00:00:55,Ravi Chinoy,775635.0,0.0,
479,363567786.0,Collect row stats while writing manifests,738.0,297.0,3.0,8.0,4.0,2.0,14.0,2020-01-16 10:24:48,2020-01-23 17:51:04,Anton Okolnychyi,6235869.0,1.0,2020-01-23 17:51:04
480,363659669.0,Gitignore for eclipse,739.0,3.0,0.0,1.0,2.0,1.0,0.0,2020-01-16 13:58:43,2020-01-16 17:09:27,Adrian Woodhead,29457.0,1.0,2020-01-16 17:09:27
481,365121745.0,upgrade spark to 3.0.0-preview2,742.0,192.0,142.0,7.0,2.0,0.0,0.0,2020-01-21 06:49:53,2020-01-21 07:59:48,yujiantao,30738525.0,0.0,
482,365204309.0,[spark-3] Bump Apache spark to 3.0.0-preview2,743.0,192.0,140.0,8.0,1.0,5.0,8.0,2020-01-21 09:41:45,2020-02-03 17:17:34,yujiantao,30738525.0,1.0,2020-02-03 17:17:34
483,365509173.0,schema evolution support,745.0,154.0,13.0,6.0,1.0,7.0,8.0,2020-01-21 21:00:14,2020-02-13 20:59:50,Ravi Chinoy,775635.0,1.0,2020-02-13 20:59:50
484,365647665.0,Pass purge option in dropTable of CachingCatalog,746.0,1.0,1.0,1.0,1.0,1.0,0.0,2020-01-22 03:40:36,2020-01-23 18:33:38,Xiang Li,13976495.0,1.0,2020-01-23 18:33:38
485,366491045.0,Make sure to use right table name when constructing a metadata table,747.0,1.0,1.0,1.0,1.0,1.0,0.0,2020-01-23 17:58:56,2020-01-23 18:32:16,Ratandeep Ratti,129474.0,1.0,2020-01-23 18:32:16
486,367189821.0,Convert Spark In filter to iceberg IN Expression,749.0,46.0,6.0,2.0,3.0,1.0,17.0,2020-01-26 07:27:47,2020-02-03 17:07:55,,12246263.0,1.0,2020-02-03 17:07:55
487,367203868.0,"Add time-travel methods (asOfTime,useSnapshot) in IcebergGenerics",750.0,179.0,55.0,2.0,2.0,1.0,12.0,2020-01-26 10:28:56,2020-01-29 17:08:17,,415742.0,1.0,2020-01-29 17:08:17
488,367264662.0,Update docs to include newly added predicate expressions,752.0,3.0,0.0,1.0,1.0,1.0,0.0,2020-01-26 21:43:48,2020-01-27 13:02:52,,12246263.0,1.0,2020-01-27 13:02:52
489,367337946.0,Fix javadoc build,753.0,1.0,1.0,1.0,1.0,0.0,0.0,2020-01-27 06:51:21,2020-01-27 12:55:08,,12246263.0,1.0,2020-01-27 12:55:07
490,367470536.0,Fix thread safety in HadoopTableOperations,754.0,1.0,1.0,1.0,1.0,4.0,0.0,2020-01-27 12:43:16,2020-01-27 17:03:38,Anton Okolnychyi,6235869.0,1.0,2020-01-27 17:03:38
491,367481000.0,Fix Python API doc intro,755.0,1.0,1.0,1.0,1.0,1.0,0.0,2020-01-27 13:08:32,2020-01-27 17:56:13,Anton Okolnychyi,6235869.0,1.0,2020-01-27 17:56:13
492,367501625.0,Make the size of Hive client pool configurable,756.0,2.0,1.0,2.0,1.0,3.0,1.0,2020-01-27 13:49:58,2020-01-27 18:02:04,Anton Okolnychyi,6235869.0,1.0,2020-01-27 18:02:04
493,368254188.0,"Update schema for field additions, updates [e.g type widening] using an input schema",759.0,192.0,0.0,4.0,1.0,10.0,10.0,2020-01-28 22:02:14,2020-09-08 17:20:58,Ratandeep Ratti,129474.0,0.0,
494,369405226.0,Schema evolution add column,762.0,213.0,13.0,6.0,2.0,0.0,0.0,2020-01-31 04:35:15,2020-01-31 04:35:28,Ravi Chinoy,775635.0,0.0,
495,369955482.0,Support in and notIn in ResidualVisitor,766.0,120.0,1.0,2.0,2.0,1.0,4.0,2020-02-02 00:16:23,2020-02-05 19:36:05,,12246263.0,1.0,2020-02-05 19:36:05
496,370098216.0,Metrics javadoc fixes #767,768.0,88.0,0.0,2.0,3.0,4.0,7.0,2020-02-03 03:09:37,2020-02-17 21:17:00,Edgar Rodriguez,266670.0,1.0,2020-02-17 21:17:00
497,370194869.0,Incremental scan follow-ups,769.0,127.0,54.0,5.0,1.0,3.0,4.0,2020-02-03 08:49:28,2020-02-05 23:52:16,Ratandeep Ratti,129474.0,0.0,
498,370355718.0,Remove warnings from the build,770.0,25.0,62.0,12.0,7.0,1.0,2.0,2020-02-03 14:44:56,2020-03-13 23:00:14,Fokko Driesprong,1134248.0,1.0,2020-03-13 23:00:14
499,370576946.0,"Hadoop tables: If the version matches, do not reload metadata.",774.0,12.0,8.0,2.0,1.0,5.0,0.0,2020-02-03 23:40:41,2020-02-04 19:28:26,Ryan Blue,87915.0,1.0,2020-02-04 19:28:26
500,370933239.0,Make GenericManifestFile compatible with Kryo,775.0,189.0,4.0,2.0,1.0,1.0,0.0,2020-02-04 16:31:07,2020-02-04 21:15:06,Anton Okolnychyi,6235869.0,1.0,2020-02-04 21:15:06
501,370935168.0,Use session state to load full Hadoop conf,776.0,7.0,3.0,2.0,1.0,6.0,0.0,2020-02-04 16:35:00,2020-02-04 23:36:23,Anton Okolnychyi,6235869.0,0.0,
502,370936895.0,Document Hadoop config options,777.0,7.0,0.0,1.0,1.0,1.0,0.0,2020-02-04 16:38:28,2020-02-05 19:21:30,Anton Okolnychyi,6235869.0,1.0,2020-02-05 19:21:30
503,371254273.0,ORC: Implement TestGenericData and fix reader and writer issues,778.0,485.0,99.0,11.0,14.0,15.0,45.0,2020-02-05 08:59:00,2020-03-31 21:54:31,Shardul Mahadik,6961317.0,1.0,2020-03-31 21:54:31
504,371490501.0,Support read-after-write eventual consistency problems on object stores,779.0,13.0,1.0,3.0,1.0,8.0,0.0,2020-02-05 17:14:18,2020-02-05 20:05:24,,45828782.0,0.0,
505,371564926.0,expire table metadata with ExpireSnapshots,780.0,270.0,24.0,6.0,1.0,16.0,1.0,2020-02-05 20:15:47,2020-03-18 17:19:28,YP,15472649.0,0.0,
506,371640611.0,Incremental scan followups,781.0,19.0,8.0,2.0,1.0,0.0,0.0,2020-02-05 23:44:46,2020-02-11 00:51:03,Ratandeep Ratti,129474.0,1.0,2020-02-11 00:51:02
507,371643377.0,Incremental scan followups,782.0,93.0,30.0,3.0,2.0,2.0,4.0,2020-02-05 23:55:59,2020-02-11 19:47:55,Ratandeep Ratti,129474.0,1.0,2020-02-11 19:47:55
508,371647870.0,Incremental scan followups,783.0,16.0,17.0,1.0,1.0,0.0,0.0,2020-02-06 00:13:22,2020-02-11 01:05:05,Ratandeep Ratti,129474.0,1.0,2020-02-11 01:05:05
509,372051854.0,Allow caller to construct HadoopInputFile and HadoopOutputFile using an existing instance of FileSystem object.,784.0,70.0,25.0,2.0,2.0,1.0,14.0,2020-02-06 18:40:20,2020-02-17 00:08:17,Vlad Rozov,12200381.0,1.0,2020-02-17 00:08:17
510,372054326.0,Overload TableMetadataParser read() method,785.0,6.0,2.0,3.0,1.0,1.0,0.0,2020-02-06 18:46:24,2020-02-11 00:24:34,Vlad Rozov,12200381.0,1.0,2020-02-11 00:24:34
511,372418319.0,replace SparkDataFile with DataFile,786.0,60.0,160.0,1.0,4.0,9.0,25.0,2020-02-07 13:43:18,2020-02-19 17:17:28,"Chen, Junjie",3960228.0,1.0,2020-02-19 17:17:28
512,373430594.0,Fix race condition in SnapshotProducer,789.0,6.0,2.0,1.0,1.0,12.0,1.0,2020-02-11 01:08:23,2020-02-11 19:45:36,Anton Okolnychyi,6235869.0,1.0,2020-02-11 19:45:36
513,373517902.0,Improve getWriter in BaseRewriteManifests,790.0,1.0,11.0,1.0,1.0,3.0,0.0,2020-02-11 07:55:05,2020-02-14 18:38:22,,12246263.0,1.0,2020-02-14 18:38:22
514,374046374.0,Updating travis to use bionic,793.0,2.0,1.0,1.0,3.0,4.0,0.0,2020-02-12 01:41:32,2020-03-13 22:57:40,Ted Gooch,1591711.0,1.0,2020-03-13 22:57:40
515,374292216.0,Fix the CI,794.0,1.0,1.0,1.0,1.0,3.0,0.0,2020-02-12 12:54:15,2020-02-12 17:26:23,Fokko Driesprong,1134248.0,1.0,2020-02-12 17:26:23
516,374294201.0,Support from Python 3.6+,795.0,9.0,2.0,1.0,2.0,4.0,0.0,2020-02-12 12:58:46,2020-02-13 21:01:38,Fokko Driesprong,1134248.0,1.0,2020-02-13 21:01:38
517,374767285.0,Support Spark Structured Streaming Read for Iceberg,796.0,1087.0,30.0,7.0,10.0,44.0,214.0,2020-02-13 09:47:24,2021-05-31 09:55:43,Saisai Shao,850797.0,0.0,
518,375876659.0,Allow cherry-picking any commit as long as it is a fast-forward,799.0,94.0,18.0,2.0,1.0,2.0,0.0,2020-02-16 21:40:24,2020-02-20 17:42:51,Ryan Blue,87915.0,1.0,2020-02-20 17:42:51
519,375877865.0,Fix manifests table for empty ManifestFiles,800.0,4.0,0.0,1.0,1.0,2.0,0.0,2020-02-16 21:53:23,2020-02-17 16:42:30,Ryan Blue,87915.0,1.0,2020-02-17 16:42:30
520,375878268.0,Fix static tables when there is no current snapshot,801.0,6.0,1.0,1.0,1.0,1.0,0.0,2020-02-16 21:57:10,2020-02-17 18:03:11,Ryan Blue,87915.0,0.0,
521,375880253.0,Update RemoveSnapshots to protect cherry-picked data files,802.0,49.0,3.0,1.0,1.0,4.0,3.0,2020-02-16 22:17:15,2020-03-09 23:17:18,Ryan Blue,87915.0,0.0,
522,375881487.0,Fix metadata tables that use manifestListLocation,803.0,18.0,23.0,5.0,3.0,3.0,0.0,2020-02-16 22:29:16,2020-02-17 18:11:32,Ryan Blue,87915.0,1.0,2020-02-17 18:11:32
523,375881715.0,Spark: Support input_file_name(),804.0,6.0,0.0,1.0,1.0,1.0,0.0,2020-02-16 22:31:47,2020-02-17 17:38:58,Ryan Blue,87915.0,1.0,2020-02-17 17:38:58
524,375888650.0,"Add all_data_files, all_manifests, and all_entries metadata tables",805.0,871.0,12.0,12.0,2.0,1.0,11.0,2020-02-16 23:39:49,2020-02-17 21:52:42,Ryan Blue,87915.0,1.0,2020-02-17 21:52:42
525,375934752.0,Fix NPE when calling locationProvider() in HadoopTableOperations with no current metadata,806.0,63.0,0.0,2.0,3.0,5.0,0.0,2020-02-17 04:37:00,2020-02-18 17:35:27,Xiang Li,13976495.0,1.0,2020-02-18 17:35:27
526,376189573.0,Update spec.md with ManifestFile row modification counts,807.0,4.0,1.0,1.0,2.0,1.0,1.0,2020-02-17 15:14:40,2020-02-18 01:18:09,"Chen, Junjie",3960228.0,1.0,2020-02-18 01:18:09
527,376316795.0,Implementing support for modifying namemapping programmatically,808.0,401.0,16.0,14.0,2.0,1.0,4.0,2020-02-17 21:14:40,2020-04-06 22:51:57,,2475372.0,0.0,
528,376452535.0,fix InclusiveMetricsEvaluator to handle negative row counts,810.0,8.0,1.0,1.0,1.0,1.0,0.0,2020-02-18 07:09:21,2020-02-18 17:37:51,"Chen, Junjie",3960228.0,1.0,2020-02-18 17:37:50
529,376907710.0,NameMapping: reassign already mapped names for new columns,811.0,386.0,37.0,3.0,6.0,5.0,10.0,2020-02-19 00:44:46,2020-02-20 22:08:51,Ryan Blue,87915.0,1.0,2020-02-20 22:08:51
530,377275760.0,Fix manifest scanning in RemoveSnapshots,812.0,57.0,3.0,2.0,1.0,1.0,0.0,2020-02-19 16:56:49,2020-02-19 17:28:56,Anton Okolnychyi,6235869.0,1.0,2020-02-19 17:28:56
531,377656139.0,Update RemoveSnapshots to protect cherry-picked data.,814.0,237.0,3.0,2.0,2.0,7.0,27.0,2020-02-20 09:55:03,2020-03-09 23:13:35,Ashish Mehta,75326.0,1.0,2020-03-09 23:13:35
532,377998166.0,Allow Long to Date Literal conversion,815.0,24.0,1.0,3.0,1.0,1.0,0.0,2020-02-20 22:03:57,2020-02-20 22:11:55,Vlad Rozov,12200381.0,1.0,2020-02-20 22:11:55
533,377999125.0,Remove all exceptions from AvoidStaticImport checkstyle rule,816.0,302.0,398.0,40.0,2.0,4.0,0.0,2020-02-20 22:06:41,2020-02-21 00:51:07,Vlad Rozov,12200381.0,0.0,
534,378561675.0,Refactor and improve BaseRewriteManifests,818.0,27.0,46.0,1.0,2.0,1.0,2.0,2020-02-22 07:14:59,2020-03-13 16:47:00,,12246263.0,1.0,2020-03-13 16:47:00
535,378566911.0,Support configurable split size for metadata tables,819.0,211.0,17.0,10.0,4.0,7.0,5.0,2020-02-22 08:25:59,2020-03-30 16:28:03,,12246263.0,1.0,2020-03-30 16:28:03
536,379086147.0,[ISSUE #813] fixed the oom in spark-shell,821.0,1.0,0.0,1.0,1.0,0.0,0.0,2020-02-24 16:31:33,2020-03-02 18:04:59,XiaokunDing,3050222.0,0.0,
537,380528509.0,Use HadoopInputFile and HadoopOutputFile FileSystem while creating ORC reader and writer.,823.0,45.0,28.0,6.0,1.0,2.0,0.0,2020-02-26 21:59:13,2020-03-02 21:58:02,Vlad Rozov,12200381.0,1.0,2020-03-02 21:58:02
538,382842911.0,Fix Spark ORC Reader creating new RowWriter for every row,826.0,2.0,1.0,1.0,1.0,2.0,0.0,2020-03-03 09:42:41,2020-03-04 18:44:17,Shardul Mahadik,6961317.0,1.0,2020-03-04 18:44:17
539,384037426.0,Refactor metadata Table tests to use a common parent,827.0,731.0,1360.0,3.0,1.0,2.0,5.0,2020-03-05 02:46:51,2020-03-06 19:38:07,Jacob Lammott,4261703.0,1.0,2020-03-06 19:38:07
540,384453695.0,iceberg-spark changes for vectorized reads,828.0,2169.0,306.0,33.0,12.0,5.0,132.0,2020-03-05 19:16:45,2020-06-15 22:16:19,Samarth Jain,1642180.0,1.0,2020-06-15 22:16:19
541,384730928.0,Add incremental scan support for Spark,829.0,110.0,0.0,2.0,1.0,1.0,0.0,2020-03-06 09:56:42,2020-03-06 19:50:38,Saisai Shao,850797.0,1.0,2020-03-06 19:50:38
542,385247732.0,Support name mapping resolution for parquet,830.0,487.0,82.0,18.0,22.0,22.0,123.0,2020-03-08 09:55:11,2020-06-17 16:57:09,"Chen, Junjie",3960228.0,1.0,2020-06-17 16:57:09
543,385915085.0,make fieldIds in SchemaVisitor thread safe,833.0,34.0,5.0,2.0,2.0,7.0,0.0,2020-03-10 03:16:29,2020-03-13 16:36:45,"Chen, Junjie",3960228.0,0.0,
544,387483471.0,Spark: Add tests for identity partition data,839.0,247.0,0.0,2.0,2.0,3.0,7.0,2020-03-12 21:22:13,2020-03-19 19:50:57,Ryan Blue,87915.0,1.0,2020-03-19 19:50:57
545,387489219.0,Fix SchemaVisitor thread safety,840.0,29.0,15.0,2.0,1.0,0.0,3.0,2020-03-12 21:39:19,2020-03-13 16:11:40,Ryan Blue,87915.0,1.0,2020-03-13 16:11:40
546,387565055.0,Upgrade Hive to 2.3.6 for Iceberg,841.0,109.0,63.0,5.0,5.0,3.0,34.0,2020-03-13 02:51:52,2020-03-17 16:21:56,Saisai Shao,850797.0,1.0,2020-03-17 16:21:56
547,388781940.0,InputFormat support for Iceberg,842.0,596.0,0.0,6.0,4.0,0.0,0.0,2020-03-15 18:09:56,2020-03-16 00:18:12,Ratandeep Ratti,129474.0,0.0,
548,388899113.0,InputFormat support for Iceberg,843.0,1175.0,19.0,8.0,8.0,23.0,124.0,2020-03-16 00:51:25,2020-04-06 23:02:57,Ratandeep Ratti,129474.0,1.0,2020-04-06 23:02:57
549,389058785.0,Add persistent IDs to partition fields,845.0,420.0,24.0,11.0,6.0,7.0,39.0,2020-03-16 08:11:45,2020-04-15 20:13:36,,12246263.0,1.0,2020-04-15 20:13:36
550,390252498.0,Allow iceberg build with Java 8 or above version,850.0,2.0,2.0,1.0,1.0,2.0,0.0,2020-03-18 06:52:49,2020-03-20 03:17:19,Xuedong Luan,2434086.0,0.0,
551,390313479.0,IcebergGenerics should support ORC format,851.0,34.0,5.0,2.0,2.0,4.0,0.0,2020-03-18 09:16:16,2020-03-22 23:35:59,Xuedong Luan,2434086.0,1.0,2020-03-22 23:35:59
552,390684600.0,Task data reader changes for vectorized reads,853.0,442.0,321.0,4.0,3.0,2.0,15.0,2020-03-18 21:54:31,2020-03-21 02:11:48,Samarth Jain,1642180.0,1.0,2020-03-21 02:11:48
553,390854514.0,Fix ConcateCloseableIterable issue with starting empty iterables,854.0,91.0,6.0,3.0,3.0,0.0,7.0,2020-03-19 08:02:52,2020-03-24 20:57:43,Saisai Shao,850797.0,1.0,2020-03-24 20:57:43
554,391636264.0,[WIP] Flink Iceberg sink,856.0,3710.0,3.0,24.0,25.0,15.0,42.0,2020-03-20 16:47:33,2020-09-11 23:07:01,Xiang Li,13976495.0,0.0,
555,391691605.0,[ISSUE #855] Add the Test Util And ORC Writer for Spark,857.0,77.0,25.0,2.0,3.0,8.0,25.0,2020-03-20 18:53:43,2020-04-04 00:03:00,XiaokunDing,3050222.0,1.0,2020-04-04 00:03:00
556,392042168.0,remove mortbay Log,861.0,3.0,10.0,3.0,1.0,1.0,0.0,2020-03-22 17:31:24,2020-03-22 23:16:05,Ryan Murray,2022305.0,1.0,2020-03-22 23:16:05
557,392133008.0,Minor fix for TableIdentifier,862.0,5.0,1.0,1.0,1.0,0.0,0.0,2020-03-23 03:21:13,2020-03-23 03:35:20,"Chen, Junjie",3960228.0,0.0,
558,392707796.0,[Doc][Minor]: Fix comments,863.0,8.0,8.0,2.0,1.0,1.0,0.0,2020-03-24 00:25:15,2020-03-24 22:15:31,Miao Wang,5033592.0,1.0,2020-03-24 22:15:31
559,394377838.0,Spark: Implement an action to rewrite manifests,875.0,1028.0,37.0,9.0,1.0,4.0,42.0,2020-03-26 19:35:05,2020-04-23 17:43:06,Anton Okolnychyi,6235869.0,1.0,2020-04-23 17:43:06
560,395206755.0,Fixes #874 Remove Netty's ConcurrentSet,876.0,2.0,2.0,1.0,1.0,1.0,0.0,2020-03-29 06:43:07,2020-03-30 16:34:28,Ratandeep Ratti,129474.0,1.0,2020-03-30 16:34:28
561,395320161.0,[Minor] Fix typo in TableMetadata comments,877.0,1.0,1.0,1.0,1.0,1.0,1.0,2020-03-29 20:59:45,2020-03-30 02:03:13,Ratandeep Ratti,129474.0,0.0,
562,395365914.0,update hadoop table to support non-namespace case,878.0,27.0,2.0,3.0,2.0,1.0,0.0,2020-03-30 02:11:30,2020-03-31 16:45:14,"Chen, Junjie",3960228.0,1.0,2020-03-31 16:45:14
563,395378919.0,Fix the ORC file read method 'schema' to 'project',879.0,6.0,6.0,5.0,1.0,2.0,0.0,2020-03-30 03:10:50,2020-03-30 21:07:38,XiaokunDing,3050222.0,1.0,2020-03-30 21:07:38
564,395414834.0,fix typos in api,880.0,11.0,11.0,11.0,1.0,0.0,0.0,2020-03-30 05:29:05,2020-03-30 16:29:36,,12246263.0,1.0,2020-03-30 16:29:36
565,395798170.0,fix: Failed to get status issue because of s3 eventual consistency,882.0,5.0,2.0,2.0,1.0,3.0,9.0,2020-03-30 17:39:40,2020-04-02 23:56:38,Sudarshan S,10800873.0,1.0,2020-04-02 23:56:38
566,396084627.0,update configuration doc with read.split.metadata-target-size table property,883.0,7.0,6.0,1.0,1.0,1.0,0.0,2020-03-31 05:34:31,2020-03-31 14:23:13,,12246263.0,1.0,2020-03-31 14:23:13
567,396307386.0,Add file_type to DataFile to support deletion file,884.0,128.0,4.0,6.0,1.0,0.0,0.0,2020-03-31 12:41:05,2020-03-31 12:41:54,"Chen, Junjie",3960228.0,0.0,
568,396311093.0,Add file_type to DataFile to support deletion file,885.0,148.0,4.0,9.0,1.0,3.0,2.0,2020-03-31 12:47:41,2020-05-25 06:08:15,"Chen, Junjie",3960228.0,0.0,
569,397064125.0,Define file and position based deletion file in spec,887.0,21.0,0.0,1.0,4.0,3.0,27.0,2020-04-01 15:21:30,2020-04-03 17:24:42,"Chen, Junjie",3960228.0,1.0,2020-04-03 17:24:42
570,397436401.0,Use Objects.requireNonNull to check parameter is or not null,888.0,157.0,120.0,39.0,4.0,1.0,4.0,2020-04-02 08:39:46,2020-04-02 23:54:19,Xuedong Luan,2434086.0,0.0,
571,397488633.0,Static import the method of Preconditions.checkArgument,889.0,408.0,319.0,79.0,1.0,6.0,0.0,2020-04-02 10:26:09,2020-04-09 19:40:10,Xuedong Luan,2434086.0,0.0,
572,398407995.0,Parquet: Use new logical type annotations,891.0,184.0,101.0,6.0,3.0,3.0,4.0,2020-04-03 22:09:13,2020-05-07 20:01:46,Ryan Blue,87915.0,1.0,2020-05-07 20:01:45
573,398731773.0,Spark: Add ORC to parameterized tests,892.0,593.0,268.0,8.0,6.0,4.0,3.0,2020-04-04 20:23:14,2020-04-09 16:11:46,Ryan Blue,87915.0,1.0,2020-04-09 16:11:46
574,399720529.0,Spark: Implement an action to remove orphan files,894.0,942.0,6.0,7.0,5.0,4.0,69.0,2020-04-06 15:20:00,2020-04-10 19:02:52,Anton Okolnychyi,6235869.0,1.0,2020-04-10 19:02:52
575,399896110.0,Fix Javadoc errors in TableScan,895.0,11.0,9.0,1.0,1.0,1.0,0.0,2020-04-06 20:44:46,2020-04-07 01:09:00,Ryan Blue,87915.0,1.0,2020-04-07 01:09:00
576,399898673.0,Avro: Support partition values using a constants map,896.0,219.0,85.0,10.0,3.0,3.0,10.0,2020-04-06 20:50:18,2020-04-09 16:28:54,Ryan Blue,87915.0,1.0,2020-04-09 16:28:54
577,399958746.0,Fix metadata class loader,898.0,12.0,2.0,6.0,1.0,2.0,0.0,2020-04-06 23:35:51,2020-04-07 17:36:52,Ryan Blue,87915.0,1.0,2020-04-07 17:36:52
578,400076704.0,ORC: Refactor readers to remove duplicate null handling code,899.0,138.0,485.0,2.0,1.0,3.0,0.0,2020-04-07 06:58:14,2020-04-09 21:31:38,Shardul Mahadik,6961317.0,1.0,2020-04-09 21:31:38
579,400159130.0,Spark: Add ORC JMH tests for IcebergSource,900.0,381.0,0.0,3.0,1.0,6.0,2.0,2020-04-07 09:48:13,2020-05-22 18:31:43,Shardul Mahadik,6961317.0,1.0,2020-05-22 18:31:43
580,400510028.0,Wrap DataFile when writing to support any implementation,901.0,201.0,3.0,2.0,4.0,1.0,0.0,2020-04-07 21:23:50,2020-04-09 03:28:44,Ryan Blue,87915.0,1.0,2020-04-09 03:28:43
