,pr_id,pr_title,pr_number,additions,deletions,pr_changed_files,pr_commits_count,pr_comments_count,pr_review_comments_count,pr_created_at,pr_closed_at,contributor,contributor_id,is_merged,pr_merged_at
291,313548136.0,Optimize ExpressionVisitors.visit method to traverse minimum nodes number required for determining the result,442.0,54.0,9.0,7.0,2.0,4.0,0.0,2019-09-03 11:33:04,2019-09-06 20:02:30,Volodymyr Vysotskyi,20928429.0,1.0,2019-09-06 20:02:30
292,313594503.0,Add null check in GenericRecord#get method to avoid failure when value is null,443.0,65.0,1.0,3.0,1.0,3.0,5.0,2019-09-03 13:32:13,2019-09-05 20:57:08,Arina Ielchiieva,15086720.0,1.0,2019-09-05 20:57:08
293,313779500.0,Use constant readers for Pig partition values,444.0,68.0,36.0,3.0,1.0,1.0,0.0,2019-09-03 21:47:03,2019-09-04 17:51:13,Ryan Blue,87915.0,1.0,2019-09-04 17:51:13
294,313784646.0,[python] Fixing typo in DecimalType and some small linting fixes,445.0,5.0,8.0,5.0,1.0,0.0,0.0,2019-09-03 22:05:15,2019-09-03 22:11:22,Ted Gooch,1591711.0,1.0,2019-09-03 22:11:22
295,313895832.0,Update doc to state that day partition transform produces data type,447.0,1.0,1.0,1.0,2.0,0.0,4.0,2019-09-04 07:23:42,2019-09-13 16:09:32,Xiang Li,13976495.0,1.0,2019-09-13 16:09:32
296,313905266.0,Correct typo about PARTITION_DATA_ID_START,448.0,1.0,1.0,1.0,2.0,4.0,2.0,2019-09-04 07:52:39,2019-09-05 16:19:55,Xiang Li,13976495.0,1.0,2019-09-05 16:19:55
297,314122408.0,Move Hive concurrency tests and run one at a time,450.0,108.0,78.0,2.0,1.0,2.0,0.0,2019-09-04 16:27:57,2019-09-04 17:00:32,Ryan Blue,87915.0,1.0,2019-09-04 17:00:32
298,314462998.0,V1 Vectorized Reader for Iceberg,452.0,1440.0,19.0,7.0,25.0,2.0,1.0,2019-09-05 11:53:07,2019-09-09 10:06:52,Gautam,1474591.0,0.0,
299,314728065.0,Create data files using overwrite,453.0,2.0,0.0,1.0,1.0,1.0,0.0,2019-09-05 22:32:08,2019-09-09 08:10:17,Ryan Blue,87915.0,1.0,2019-09-09 08:10:17
300,314735556.0,InputFile.newStream should throw NotFoundException when the file does not exist,454.0,41.0,1.0,4.0,2.0,2.0,0.0,2019-09-05 23:04:18,2019-09-06 20:26:20,John Zhuge,1883812.0,1.0,2019-09-06 20:26:20
301,314753234.0,Avoid parallel runs of Spark Hive table tests,455.0,7.0,7.0,1.0,1.0,0.0,0.0,2019-09-06 00:44:07,2019-09-06 20:22:53,Ryan Blue,87915.0,1.0,2019-09-06 20:22:52
302,314755888.0,Fix avro data test schema according to spec,456.0,27.0,20.0,3.0,2.0,2.0,4.0,2019-09-06 01:01:53,2019-09-06 20:25:05,Edgar Rodriguez,266670.0,1.0,2019-09-06 20:25:05
303,315128319.0,Add metadata tables for path-based tables,458.0,500.0,30.0,9.0,2.0,2.0,6.0,2019-09-06 22:05:51,2019-09-19 21:54:21,Xabriel J. Collazo Mojica,218555.0,1.0,2019-09-19 21:54:21
304,315376204.0,Add a unit test for testing import as hive table for importSparkTable,461.0,26.0,0.0,1.0,3.0,4.0,5.0,2019-09-09 06:25:23,2019-09-12 13:55:15,"Chen, Junjie",3960228.0,1.0,2019-09-12 13:55:15
305,315463839.0,Added V1 Vectorized Reader,462.0,1440.0,19.0,7.0,1.0,0.0,1.0,2019-09-09 10:30:46,2020-04-07 23:03:50,Gautam,1474591.0,0.0,
306,315823502.0,Make the static factory methods of the MappedField and MappedFields c…,465.0,6.0,6.0,2.0,1.0,5.0,0.0,2019-09-10 05:39:26,2019-09-12 00:20:37,Puneet Zaroo,2358709.0,1.0,2019-09-12 00:20:37
307,315834830.0,[FollowUp]: Throw NotFoundException from IO methods when file does not exist ,466.0,2.0,1.0,2.0,6.0,5.0,0.0,2019-09-10 06:25:25,2019-09-19 20:19:25,Miao Wang,5033592.0,1.0,2019-09-19 20:19:25
308,316202341.0,Change method signature of ManifestReader::read (#459),467.0,20.0,19.0,8.0,1.0,9.0,1.0,2019-09-10 22:26:06,2019-10-29 21:32:47,Xingyuan Lin,47990574.0,1.0,2019-10-29 21:32:46
309,316244584.0,Enable build without .git directory,468.0,41.0,6.0,1.0,8.0,1.0,8.0,2019-09-11 02:19:43,2019-09-20 20:09:49,Jason Xu,26215547.0,1.0,2019-09-20 20:09:49
310,316585918.0,Add key_metadata to DataTableScan SCAN_COLUMNS,469.0,1.0,1.0,1.0,1.0,1.0,0.0,2019-09-11 18:50:32,2019-09-12 00:30:07,,50034283.0,1.0,2019-09-12 00:30:07
311,316631081.0,WIP: Not throw exception if table is not found,470.0,0.0,1.0,1.0,1.0,5.0,0.0,2019-09-11 20:54:52,2019-09-12 17:44:09,,2379129.0,0.0,
312,316672423.0,Bugfix in BaseTransaction to allow create and append in the same tran…,472.0,27.0,1.0,2.0,1.0,3.0,4.0,2019-09-11 23:27:15,2019-09-12 17:59:40,Parth Brahmbhatt,6914358.0,1.0,2019-09-12 17:59:40
313,317486164.0,Optimize ParquetMetricsRowGroupFilter by using ByteBuffer,473.0,10.0,7.0,1.0,1.0,3.0,0.0,2019-09-13 21:18:13,2019-09-14 00:53:03,Sujith Jay Nair,17567499.0,1.0,2019-09-14 00:53:03
314,317993034.0,Fix typo in the message for refreshing table metadata,474.0,2.0,2.0,2.0,1.0,6.0,0.0,2019-09-16 17:52:01,2019-09-23 06:54:07,Xiang Li,13976495.0,0.0,
315,318229927.0,Fix testImportAsHiveTable when create an unpartition table the spec mast unpartitioned,477.0,1.0,1.0,1.0,1.0,0.0,0.0,2019-09-17 08:52:01,2019-09-17 09:10:26,XiaokunDing,3050222.0,0.0,
316,318248314.0,Fix testImportAsHiveTable when create a unpartition table the spec  should be to unpartitioned,478.0,4.0,4.0,1.0,1.0,1.0,0.0,2019-09-17 09:36:39,2019-09-19 23:56:01,XiaokunDing,3050222.0,1.0,2019-09-19 23:56:01
317,319003010.0,Refactor AssertHelpers and TestHelpers to Reduce Code Duplication,485.0,40.0,96.0,10.0,1.0,4.0,0.0,2019-09-18 21:13:59,2019-09-20 00:28:39,Sujith Jay Nair,17567499.0,1.0,2019-09-20 00:28:39
318,319407998.0,Optimize StreamingDelete,486.0,6.0,0.0,1.0,2.0,4.0,1.0,2019-09-19 18:30:42,2019-09-19 23:53:11,Sujith Jay Nair,17567499.0,1.0,2019-09-19 23:53:11
319,319893373.0,Add TIME_MICROS support to GenericParquetReaders,487.0,16.0,1.0,2.0,3.0,6.0,6.0,2019-09-20 21:59:28,2019-09-23 17:40:18,Ashley Cox,7006859.0,1.0,2019-09-23 17:40:17
320,320042504.0,Bump Apache Parquet to 1.10.1,488.0,7.0,7.0,2.0,2.0,1.0,0.0,2019-09-22 12:50:23,2019-09-23 17:53:39,Fokko Driesprong,1134248.0,1.0,2019-09-23 17:53:39
321,320042538.0,Bump Apache Spark to 2.4.4,489.0,21.0,20.0,3.0,5.0,7.0,2.0,2019-09-22 12:51:10,2019-09-30 22:09:42,Fokko Driesprong,1134248.0,1.0,2019-09-30 22:09:42
322,321428768.0,Adding back public access to Builder add method,496.0,74.0,28.0,2.0,5.0,4.0,0.0,2019-09-25 20:38:29,2019-09-26 06:47:54,Gautam,1474591.0,0.0,
323,321482629.0,Support retaining last N snapshots,497.0,370.0,1.0,3.0,6.0,13.0,35.0,2019-09-25 23:55:26,2019-12-27 22:42:33,YP,15472649.0,1.0,2019-12-27 22:42:33
324,321569427.0,Adding partition transform builder methods to set custom target field names ,498.0,126.0,29.0,2.0,4.0,5.0,10.0,2019-09-26 07:04:36,2019-09-27 16:54:00,Gautam,1474591.0,1.0,2019-09-27 16:54:00
325,321938995.0,Add persistent IDs to partition fields (WIP),499.0,159.0,57.0,9.0,1.0,21.0,28.0,2019-09-26 23:01:03,2020-04-06 23:05:15,,22434010.0,0.0,
326,322359298.0,Fix snapshot summary data for appended manifests.,503.0,37.0,4.0,6.0,3.0,0.0,2.0,2019-09-27 23:39:02,2019-09-30 17:53:28,Ryan Blue,87915.0,1.0,2019-09-30 17:53:28
327,322774367.0,Handling Date type conversion as epochDay integer ordinal ,506.0,70.0,0.0,2.0,7.0,4.0,8.0,2019-09-30 13:11:21,2019-09-30 23:03:11,Gautam,1474591.0,1.0,2019-09-30 23:03:11
328,322991715.0,Remove flaky Hive table tests,509.0,6.0,380.0,1.0,1.0,2.0,0.0,2019-09-30 21:54:29,2019-10-01 07:48:29,Ryan Blue,87915.0,1.0,2019-10-01 07:48:29
329,324270215.0,Expose partition spec info,511.0,125.0,1.0,6.0,1.0,0.0,2.0,2019-10-03 15:15:46,2019-10-09 16:19:51,Anton Okolnychyi,6235869.0,1.0,2019-10-09 16:19:51
330,324273367.0,Extend RewriteManifests with a way to add/delete manifests,512.0,612.0,38.0,5.0,1.0,12.0,40.0,2019-10-03 15:22:19,2019-11-12 18:01:45,Anton Okolnychyi,6235869.0,1.0,2019-11-12 18:01:45
331,324286770.0,Fix concurrency issue in HiveTableOperations when Table is reused,513.0,14.0,12.0,2.0,1.0,5.0,9.0,2019-10-03 15:51:27,2019-10-09 18:20:34,Anton Okolnychyi,6235869.0,1.0,2019-10-09 18:20:34
332,324299000.0,Spark: Add option to allow writing optional to required fields (#510),514.0,189.0,8.0,5.0,1.0,18.0,27.0,2019-10-03 16:20:08,2019-11-13 01:39:49,Andrei Ionescu,3389505.0,1.0,2019-11-13 01:39:48
333,325197579.0,Improve vectorized read performance for non-dictionary encoded data,516.0,2697.0,834.0,39.0,7.0,0.0,0.0,2019-10-07 09:05:42,2019-10-07 19:08:32,Samarth Jain,1642180.0,1.0,2019-10-07 19:08:32
334,325764176.0,Docs: use append mode for Spark append doc,517.0,3.0,2.0,1.0,1.0,1.0,0.0,2019-10-08 13:10:06,2019-10-08 15:35:15,Xiang Li,13976495.0,1.0,2019-10-08 15:35:15
335,325958875.0,Fix typos in documentation.,523.0,6.0,6.0,4.0,1.0,1.0,0.0,2019-10-08 20:53:01,2019-10-09 16:01:57,Benjamin Tsai,187570.0,1.0,2019-10-09 16:01:57
336,325999455.0,respect commit.manifest.min.count,524.0,92.0,5.0,3.0,2.0,8.0,19.0,2019-10-08 23:05:59,2019-11-16 21:08:04,,22434010.0,1.0,2019-11-16 21:08:03
337,326393850.0,Apply Baseline to iceberg-pig,525.0,179.0,207.0,8.0,6.0,8.0,17.0,2019-10-09 18:43:50,2019-10-27 21:06:23,Fokko Driesprong,1134248.0,1.0,2019-10-27 21:06:23
338,326428062.0,Add Baseline to iceberg-parquet,526.0,457.0,496.0,30.0,7.0,4.0,19.0,2019-10-09 20:14:03,2019-10-22 18:17:29,Fokko Driesprong,1134248.0,1.0,2019-10-22 18:17:29
339,326437161.0,Update docs to Gradle 5.4.1,527.0,1.0,1.0,1.0,1.0,1.0,0.0,2019-10-09 20:36:49,2019-10-09 20:38:11,Fokko Driesprong,1134248.0,1.0,2019-10-09 20:38:11
340,326697147.0,Add hadoop table catalog,529.0,226.0,0.0,2.0,8.0,6.0,59.0,2019-10-10 11:58:42,2019-11-12 17:13:58,"Chen, Junjie",3960228.0,1.0,2019-11-12 17:13:58
341,326709098.0,[python] adding Hive package to wrap BaseMetastoreTables/TableOperations,530.0,300.0,1.0,9.0,1.0,1.0,12.0,2019-10-10 12:27:59,2019-10-18 18:28:13,Ted Gooch,1591711.0,1.0,2019-10-18 18:28:13
342,326822382.0,Update build for Apache releases,531.0,654.0,17.0,35.0,13.0,0.0,2.0,2019-10-10 16:20:14,2019-10-10 17:27:36,Ryan Blue,87915.0,1.0,2019-10-10 17:27:36
343,326844725.0,Avoid NullPointerException when a source column is missing,532.0,2.0,0.0,1.0,1.0,0.0,0.0,2019-10-10 17:19:21,2019-10-10 17:42:58,Ryan Blue,87915.0,1.0,2019-10-10 17:42:58
344,326850577.0,Update Jackson to 2.9.10 for CVE-2019-14379,533.0,10.0,10.0,2.0,3.0,1.0,0.0,2019-10-10 17:35:18,2019-10-10 19:18:49,Ryan Blue,87915.0,0.0,
345,326857666.0,Remove version.txt accidentally in release update PR,534.0,0.0,1.0,1.0,1.0,0.0,0.0,2019-10-10 17:53:24,2019-10-10 18:21:23,Ryan Blue,87915.0,1.0,2019-10-10 18:21:22
346,326873699.0,Update Jackson to 2.9.10 for CVE-2019-14379,535.0,10.0,10.0,2.0,3.0,3.0,0.0,2019-10-10 18:34:28,2019-10-10 19:18:21,,8975385.0,1.0,2019-10-10 19:18:21
347,326921794.0,Add How to Release docs,536.0,119.0,2.0,2.0,1.0,0.0,0.0,2019-10-10 20:44:10,2019-10-15 20:25:18,Ryan Blue,87915.0,1.0,2019-10-15 20:25:18
348,326994080.0,Docs: Fix typos,537.0,1.0,1.0,1.0,1.0,1.0,1.0,2019-10-11 01:43:50,2019-10-18 00:24:09,Benjamin Tsai,187570.0,0.0,
349,327321101.0,Fix connection leak in Hive table tests,538.0,409.0,8.0,3.0,4.0,1.0,0.0,2019-10-11 18:41:19,2019-10-11 22:24:30,Ryan Blue,87915.0,1.0,2019-10-11 22:24:30
350,327434216.0,Replace StringBuffer by StringBuilder,539.0,10.0,10.0,2.0,1.0,5.0,0.0,2019-10-12 06:50:34,2019-10-27 21:34:25,Fokko Driesprong,1134248.0,1.0,2019-10-27 21:34:24
351,327676841.0,Avoid NullPointerException in FindFiles when there is no snapshot,543.0,17.0,0.0,2.0,3.0,5.0,5.0,2019-10-14 07:36:26,2019-10-18 16:05:39,Xiang Li,13976495.0,1.0,2019-10-18 16:05:38
352,327793153.0,[python] Adding parquet package which contains classes necessary for …,544.0,1513.0,3.0,14.0,1.0,6.0,16.0,2019-10-14 13:09:49,2020-07-31 19:32:23,Ted Gooch,1591711.0,0.0,
353,327979174.0,Use Java collections in GenericDataFile to fix Kryo serialization,546.0,149.0,6.0,3.0,2.0,3.0,4.0,2019-10-14 21:26:36,2019-10-15 16:36:43,Ryan Blue,87915.0,1.0,2019-10-15 16:36:42
354,327983103.0,Remove comment handling in Schema because field handles it,547.0,1.0,1.0,1.0,1.0,0.0,0.0,2019-10-14 21:38:45,2019-10-14 21:57:57,Ryan Blue,87915.0,1.0,2019-10-14 21:57:57
355,328001334.0,Update license docs for 0.7.0 release,548.0,35.0,0.0,4.0,2.0,0.0,0.0,2019-10-14 22:48:06,2019-10-15 00:59:45,Ryan Blue,87915.0,1.0,2019-10-15 00:59:45
356,328089436.0,Add Spark custom Kryo registrator,549.0,87.0,26.0,10.0,1.0,12.0,5.0,2019-10-15 05:54:01,2019-12-18 19:40:23,John Zhuge,1883812.0,0.0,
357,328411491.0,Bump ORC from 1.5.5 to 1.5.6,550.0,3.0,3.0,2.0,1.0,1.0,0.0,2019-10-15 18:44:20,2019-10-17 16:39:48,Fokko Driesprong,1134248.0,1.0,2019-10-17 16:39:48
358,328721589.0,"[python] First add to docs, addresses #323 and #363",551.0,308.0,3.0,5.0,1.0,4.0,18.0,2019-10-16 11:59:38,2019-10-18 00:22:47,Ted Gooch,1591711.0,1.0,2019-10-18 00:22:47
359,329087486.0,Fix IllegalArgumentException in DataFiles.Builder.withPartitionPath,554.0,12.0,8.0,3.0,1.0,2.0,0.0,2019-10-17 06:21:49,2019-10-17 16:22:38,John Zhuge,1883812.0,1.0,2019-10-17 16:22:38
360,329494584.0,Fix Kryo serialization in ParquetUtil.getSplitOffsets,556.0,35.0,2.0,2.0,2.0,1.0,0.0,2019-10-17 22:55:16,2019-10-18 16:06:20,John Zhuge,1883812.0,1.0,2019-10-18 16:06:20
361,329888090.0,Fix JitPack builds,557.0,5.0,3.0,1.0,1.0,4.0,0.0,2019-10-18 19:16:11,2019-10-18 19:41:37,Ryan Blue,87915.0,1.0,2019-10-18 19:41:37
362,329893162.0,[python] Removing unused config options and fixing Status issue in ManifesEntry,558.0,1.0,5.0,2.0,1.0,0.0,0.0,2019-10-18 19:31:24,2019-10-18 20:20:08,Ted Gooch,1591711.0,1.0,2019-10-18 20:20:08
363,329896859.0,Fix key metadata serialization,560.0,82.0,82.0,2.0,4.0,0.0,0.0,2019-10-18 19:43:15,2019-10-18 22:06:11,Ryan Blue,87915.0,1.0,2019-10-18 22:06:11
364,329951861.0,Use location of OutputFile in HMS for metadata files,566.0,25.0,1.0,2.0,1.0,1.0,0.0,2019-10-18 23:02:30,2019-10-19 00:01:21,Anton Okolnychyi,6235869.0,1.0,2019-10-19 00:01:21
365,330692495.0,Use broadcast variables in IcebergSource,569.0,124.0,43.0,6.0,1.0,17.0,0.0,2019-10-21 21:05:01,2019-12-09 18:25:29,Anton Okolnychyi,6235869.0,1.0,2019-12-09 18:25:29
366,331276219.0,Update copyright dates in NOTICE,573.0,1.0,1.0,1.0,1.0,0.0,0.0,2019-10-23 00:08:16,2019-10-25 19:53:26,Ryan Blue,87915.0,1.0,2019-10-25 19:53:26
367,331759262.0,Add incompatible changes to UpdateSchema API,574.0,309.0,41.0,4.0,2.0,2.0,11.0,2019-10-23 21:47:16,2019-11-12 16:57:59,Ryan Blue,87915.0,1.0,2019-11-12 16:57:59
368,332561452.0,Try to improve TestScanSummary time based operations,576.0,4.0,2.0,1.0,1.0,0.0,1.0,2019-10-25 15:18:13,2019-11-13 19:11:10,Holden Karau,59893.0,0.0,
369,332709980.0,Add Java 11 to the testsuite,577.0,216.0,185.0,6.0,3.0,23.0,0.0,2019-10-25 23:21:11,2020-07-06 15:53:41,Fokko Driesprong,1134248.0,0.0,
370,332717742.0,Update docs for the 0.7.0-incubating release,579.0,140375.0,3.0,428.0,2.0,1.0,0.0,2019-10-26 00:18:18,2019-10-27 20:43:26,Ryan Blue,87915.0,1.0,2019-10-27 20:43:26
371,332786942.0,Infer mapping from expected schema if file schema does not have field-ids and name mapping is missing,580.0,157.0,7.0,6.0,1.0,3.0,6.0,2019-10-26 17:44:39,2019-10-30 20:59:45,Ratandeep Ratti,129474.0,1.0,2019-10-30 20:59:45
372,332795324.0,Update .gitignore,581.0,6.0,0.0,1.0,1.0,1.0,0.0,2019-10-26 19:39:57,2019-10-27 20:44:01,Ratandeep Ratti,129474.0,1.0,2019-10-27 20:44:01
373,332885835.0,Update jackson databind to 2.10.0 (#582),583.0,6.0,6.0,2.0,1.0,2.0,0.0,2019-10-27 19:35:29,2019-10-28 13:44:02,Ratandeep Ratti,129474.0,1.0,2019-10-28 13:44:02
374,333152435.0,Fix Iceberg Reader for nested partitions (#575),585.0,293.0,138.0,5.0,7.0,29.0,51.0,2019-10-28 14:41:53,2020-04-09 21:22:41,Andrei Ionescu,3389505.0,0.0,
375,333198468.0,Improve docs on converting the Avro schema,587.0,25.0,10.0,3.0,9.0,5.0,28.0,2019-10-28 16:09:23,2019-11-20 18:05:30,Fokko Driesprong,1134248.0,1.0,2019-11-20 18:05:30
376,333208567.0,[WIP] Add sequence number for supporting row level delete,588.0,574.0,49.0,25.0,14.0,19.0,42.0,2019-10-28 16:30:21,2020-04-24 08:16:54,"Chen, Junjie",3960228.0,0.0,
377,333699468.0,[WIP] Extend metadata with SortOrder,589.0,838.0,56.0,16.0,1.0,9.0,22.0,2019-10-29 15:39:23,2020-08-24 23:21:29,Anton Okolnychyi,6235869.0,0.0,
378,333918180.0,Allow spark.read.schema() to be set.,590.0,226.0,1.0,2.0,1.0,12.0,4.0,2019-10-29 22:44:26,2019-11-13 20:57:38,Xabriel J. Collazo Mojica,218555.0,1.0,2019-11-13 20:57:38
379,334062306.0,Decouple TableMetadataParser and TableMetadata from TableOperations,591.0,126.0,115.0,19.0,1.0,1.0,5.0,2019-10-30 07:11:30,2019-11-20 17:48:40,Xingyuan Lin,47990574.0,1.0,2019-11-20 17:48:40
380,334564175.0,Scope pig properties specific to a load using signatures,593.0,21.0,18.0,2.0,2.0,1.0,0.0,2019-10-30 23:12:15,2019-10-31 21:31:03,Daniel Weeks,4925077.0,1.0,2019-10-31 21:31:03
381,334636933.0,Add in and not in predicates,594.0,870.0,66.0,19.0,9.0,1.0,0.0,2019-10-31 03:10:04,2019-10-31 19:58:06,,12246263.0,1.0,2019-10-31 19:58:06
382,334806709.0,Make the convert in AvroSchemaUtil consistent,596.0,6.0,1.0,1.0,1.0,0.0,0.0,2019-10-31 10:41:48,2019-10-31 10:46:25,Fokko Driesprong,1134248.0,0.0,
383,335165873.0,Refactor the build into multiple gradle scripts.,599.0,280.0,177.0,5.0,1.0,1.0,0.0,2019-10-31 21:32:13,2019-11-01 13:13:06,Ryan Blue,87915.0,1.0,2019-11-01 13:13:06
384,335297309.0,Implement in and notIn in multiple visitors,600.0,1053.0,340.0,10.0,8.0,10.0,39.0,2019-11-01 06:40:52,2019-12-27 21:07:54,,12246263.0,1.0,2019-12-27 21:07:54
385,335584249.0,Fix Parquet with special characters in field names.,601.0,228.0,34.0,11.0,8.0,3.0,7.0,2019-11-01 19:38:55,2019-11-09 01:25:37,Ryan Blue,87915.0,1.0,2019-11-09 01:25:36
386,336015247.0,Add Java 11 support,602.0,28.0,10.0,4.0,3.0,2.0,0.0,2019-11-03 11:23:01,2019-11-03 19:01:50,Fokko Driesprong,1134248.0,0.0,
387,336189039.0,Disable ErrorProne during compilation of JMH generated classes,606.0,4.0,0.0,1.0,1.0,1.0,0.0,2019-11-04 09:49:10,2019-11-06 09:21:49,Shardul Mahadik,6961317.0,1.0,2019-11-06 09:21:48
388,336441091.0,Fix MissingOverride error,608.0,20.0,1.0,5.0,1.0,4.0,0.0,2019-11-04 19:34:06,2019-11-06 09:25:34,Fokko Driesprong,1134248.0,1.0,2019-11-06 09:25:34
389,336442212.0,Fix ImmutableEnumChecker error,609.0,1.0,1.0,1.0,1.0,1.0,0.0,2019-11-04 19:36:56,2019-11-06 18:36:56,Fokko Driesprong,1134248.0,1.0,2019-11-06 18:36:55
390,336445664.0,Fix MutableConstantField error,610.0,12.0,15.0,10.0,1.0,1.0,0.0,2019-11-04 19:45:40,2019-11-06 18:38:08,Fokko Driesprong,1134248.0,1.0,2019-11-06 18:38:08
391,336457753.0,Fix EqualsGetClass error,611.0,31.0,57.0,18.0,3.0,0.0,2.0,2019-11-04 20:15:29,2019-11-06 18:36:18,Fokko Driesprong,1134248.0,1.0,2019-11-06 18:36:18
392,336460306.0,Fix ObjectsHashCodePrimitive error,612.0,1.0,2.0,1.0,2.0,0.0,1.0,2019-11-04 20:22:22,2019-11-06 18:38:49,Fokko Driesprong,1134248.0,1.0,2019-11-06 18:38:49
393,336462603.0,Fix Finally error,613.0,4.0,15.0,1.0,1.0,0.0,0.0,2019-11-04 20:28:39,2019-11-04 21:36:09,Fokko Driesprong,1134248.0,0.0,
394,336464069.0,Fix InconsistentCapitalization error,614.0,2.0,2.0,1.0,1.0,1.0,0.0,2019-11-04 20:32:45,2019-11-06 18:34:21,Fokko Driesprong,1134248.0,1.0,2019-11-06 18:34:20
395,336475334.0,Fix PreconditionsInvalidPlaceholder error,615.0,2.0,2.0,2.0,1.0,0.0,0.0,2019-11-04 21:01:16,2019-11-06 18:39:11,Fokko Driesprong,1134248.0,1.0,2019-11-06 18:39:11
396,336484429.0,Rename runtime folder to spark-runtime for consistency,616.0,2.0,2.0,3.0,1.0,1.0,0.0,2019-11-04 21:19:51,2019-11-09 00:36:58,Ratandeep Ratti,129474.0,1.0,2019-11-09 00:36:58
397,336914925.0,Fix for 'Error reading Avro files containing array of struct with 2 fields #605',618.0,83.0,4.0,4.0,2.0,1.0,3.0,2019-11-05 18:06:42,2019-11-09 01:24:29,Ratandeep Ratti,129474.0,1.0,2019-11-09 01:24:29
398,337290272.0,Add schema validator,619.0,50.0,20.0,8.0,5.0,7.0,8.0,2019-11-06 10:40:45,2019-11-20 23:59:35,"Chen, Junjie",3960228.0,1.0,2019-11-20 23:59:35
399,337324986.0,Enable namespace support in hive catalog,620.0,4.0,4.0,1.0,1.0,0.0,0.0,2019-11-06 12:03:55,2019-11-08 08:09:34,"Chen, Junjie",3960228.0,0.0,
400,338480172.0,Fix iceberg-api javadoc @link issue,622.0,34.0,31.0,5.0,1.0,1.0,0.0,2019-11-08 05:25:56,2019-11-08 23:53:27,,12246263.0,1.0,2019-11-08 23:53:27
401,338729473.0,Update SparkTableUtil to use SessionCatalog and proper MetricsConfig,624.0,464.0,148.0,6.0,1.0,4.0,24.0,2019-11-08 15:31:20,2019-11-11 20:57:25,Anton Okolnychyi,6235869.0,1.0,2019-11-11 20:57:25
402,338890252.0,Support reading Avro enums as strings,625.0,212.0,0.0,6.0,2.0,3.0,8.0,2019-11-08 22:55:10,2019-11-09 01:21:45,Shardul Mahadik,6961317.0,1.0,2019-11-09 01:21:45
403,339208045.0,Update indexing to handle nested lists,627.0,59.0,20.0,3.0,4.0,8.0,9.0,2019-11-11 00:11:48,2019-11-13 03:41:13,Ryan Blue,87915.0,1.0,2019-11-13 03:41:12
404,339299078.0,Implement the project and the projectStrict in the transforms,628.0,688.0,48.0,9.0,14.0,10.0,14.0,2019-11-11 07:58:00,2019-12-27 21:09:56,,12246263.0,1.0,2019-12-27 21:09:56
405,340047134.0,[python] Temporary fix for mo_sql_parser breakage,630.0,2.0,2.0,2.0,1.0,2.0,0.0,2019-11-12 18:24:36,2019-11-12 19:31:22,Ted Gooch,1591711.0,1.0,2019-11-12 19:31:22
406,340081131.0,Add mechanism to expire old metadata versions,631.0,408.0,20.0,6.0,4.0,4.0,25.0,2019-11-12 19:47:50,2019-11-16 00:51:07,YP,15472649.0,1.0,2019-11-16 00:51:07
407,340174049.0,Support for vectorized reads for dictionary encoded along with various performance improvements,632.0,4202.0,1086.0,49.0,10.0,0.0,0.0,2019-11-13 00:14:27,2019-11-13 00:14:45,Samarth Jain,1642180.0,0.0,
408,340180212.0,Vectorized reads for dictionary encoded data,633.0,1776.0,523.0,25.0,10.0,0.0,0.0,2019-11-13 00:39:00,2019-11-13 00:58:21,Samarth Jain,1642180.0,0.0,
409,340186374.0,Vectorized reads for dictionary encoded data,634.0,1776.0,523.0,25.0,1.0,0.0,0.0,2019-11-13 01:05:19,2019-11-13 01:06:51,Samarth Jain,1642180.0,1.0,2019-11-13 01:06:51
410,340290480.0,Enable parallel execution for Gradle build,635.0,1.0,0.0,1.0,1.0,1.0,0.0,2019-11-13 07:50:33,2019-11-13 17:49:19,Xiang Li,13976495.0,1.0,2019-11-13 17:49:19
411,340510880.0,Extend SparkTableUtil to import only certain partitions,637.0,58.0,6.0,2.0,1.0,1.0,0.0,2019-11-13 15:07:04,2019-11-13 17:03:51,Anton Okolnychyi,6235869.0,1.0,2019-11-13 17:03:51
412,340553403.0,Remove the gradle-wrapper jar from the repo,639.0,1.0,0.0,2.0,1.0,0.0,0.0,2019-11-13 16:29:47,2019-11-13 17:22:52,Fokko Driesprong,1134248.0,1.0,2019-11-13 17:22:52
413,340585899.0,Allow ordered projections when writing,640.0,247.0,18.0,6.0,1.0,1.0,0.0,2019-11-13 17:39:40,2019-11-13 22:00:12,Xabriel J. Collazo Mojica,218555.0,1.0,2019-11-13 22:00:12
414,340600821.0,Fix flaky ScanSummary test,641.0,2.0,2.0,1.0,1.0,0.0,0.0,2019-11-13 18:18:09,2019-11-13 19:11:11,Ryan Blue,87915.0,1.0,2019-11-13 19:11:10
415,340618931.0,Use SessionState to load Hadoop conf,642.0,14.0,14.0,9.0,1.0,1.0,0.0,2019-11-13 19:06:30,2019-11-13 20:59:38,Anton Okolnychyi,6235869.0,1.0,2019-11-13 20:59:38
416,341600752.0,[python] Removing defunct iceberg.api.exception module,649.0,0.0,26.0,1.0,1.0,0.0,0.0,2019-11-15 19:13:29,2019-11-15 19:46:37,Ted Gooch,1591711.0,1.0,2019-11-15 19:46:37
417,341907218.0,Refactor in and notIn expressions,650.0,733.0,460.0,22.0,2.0,1.0,3.0,2019-11-17 22:46:20,2019-11-20 17:58:40,Ryan Blue,87915.0,1.0,2019-11-20 17:58:40
418,341909196.0,Add back old constructor to BinPacking,651.0,5.0,0.0,1.0,1.0,0.0,0.0,2019-11-17 23:05:11,2019-11-19 14:51:34,Ryan Blue,87915.0,1.0,2019-11-19 14:51:34
419,341910000.0,Fix UUID check for existing tables without a UUID,652.0,16.0,11.0,3.0,3.0,7.0,1.0,2019-11-17 23:13:09,2020-02-18 21:02:59,Ryan Blue,87915.0,1.0,2020-02-18 21:02:59
420,341912788.0,Add CachingCatalog,653.0,242.0,1.0,5.0,2.0,6.0,10.0,2019-11-17 23:39:34,2019-11-20 09:30:18,Ryan Blue,87915.0,1.0,2019-11-20 09:30:18
421,341913999.0,Move identifier validation into BaseMetastoreCatalog,654.0,88.0,59.0,3.0,3.0,4.0,0.0,2019-11-17 23:53:23,2019-11-20 19:26:49,Ryan Blue,87915.0,1.0,2019-11-20 19:26:49
422,341920801.0,Add PartitionsTable for partition metadata,655.0,288.0,16.0,7.0,5.0,4.0,7.0,2019-11-18 00:52:28,2019-11-21 00:00:40,Ryan Blue,87915.0,1.0,2019-11-21 00:00:40
423,341921702.0,Fix case sensitivity setting in Spark,656.0,2.0,2.0,1.0,1.0,1.0,1.0,2019-11-18 00:59:35,2019-11-19 13:22:31,Ryan Blue,87915.0,1.0,2019-11-19 13:22:31
424,342029811.0,Add list tables support in Iceberg catalog,657.0,132.0,0.0,5.0,2.0,1.0,8.0,2019-11-18 08:39:26,2019-11-19 17:57:06,Saisai Shao,850797.0,1.0,2019-11-19 17:57:06
425,343426404.0,Implement listTables in CachingCatalog,662.0,7.0,0.0,1.0,1.0,2.0,0.0,2019-11-20 15:48:00,2019-11-20 17:13:51,Anton Okolnychyi,6235869.0,1.0,2019-11-20 17:13:50
426,343723770.0,"Cleanup code, rename classes. Add tests for dictionary encoded data",663.0,3264.0,1606.0,41.0,2.0,0.0,0.0,2019-11-20 21:08:06,2019-11-20 21:08:52,Samarth Jain,1642180.0,0.0,
427,343728174.0,"Clean up code, rename classes, add unit tests for dictionary encoded data",664.0,2050.0,1645.0,26.0,1.0,0.0,0.0,2019-11-20 21:19:33,2019-11-20 23:41:57,Samarth Jain,1642180.0,1.0,2019-11-20 23:41:57
428,343875740.0,PR#1 for merging vectorized-read branch into master,665.0,2129.0,42.0,14.0,1.0,5.0,3.0,2019-11-21 07:03:08,2019-12-06 00:22:47,Samarth Jain,1642180.0,0.0,
429,344272933.0,BaseRewriteManifests should keep different manifest for different partitionSpec,666.0,200.0,22.0,2.0,3.0,10.0,19.0,2019-11-21 22:59:21,2020-01-07 18:33:21,,22434010.0,1.0,2020-01-07 18:33:21
430,344297056.0,Fix various checkstyle issues,667.0,2275.0,1847.0,18.0,1.0,0.0,0.0,2019-11-22 00:31:30,2019-11-22 00:36:39,Samarth Jain,1642180.0,1.0,2019-11-22 00:36:39
431,344334382.0,Hybrid Vectorized reader defaulting to Row-based reading,668.0,9669.0,1628.0,129.0,11.0,0.0,0.0,2019-11-22 03:35:00,2019-11-22 03:35:12,Gautam,1474591.0,0.0,
432,344334740.0,Hybrid Vectorized reader defaulting to Row-based reading,669.0,798.0,165.0,7.0,2.0,1.0,0.0,2019-11-22 03:36:45,2019-11-23 02:09:53,Gautam,1474591.0,1.0,2019-11-23 02:09:52
433,344791484.0,Merge master branch. Fix projection and filtering test failures,670.0,162436.0,5537.0,869.0,196.0,1.0,0.0,2019-11-23 09:09:25,2019-11-25 23:20:43,Samarth Jain,1642180.0,1.0,2019-11-25 23:20:43
434,344885124.0,Add case insensitive support to CachingCatalog,671.0,42.0,7.0,3.0,3.0,3.0,7.0,2019-11-24 08:38:43,2019-11-25 20:48:50,John Zhuge,1883812.0,1.0,2019-11-25 20:48:50
