,pr_id,pr_title,pr_number,additions,deletions,pr_changed_files,pr_commits_count,pr_comments_count,pr_review_comments_count,pr_created_at,pr_closed_at,contributor,contributor_id,is_merged,pr_merged_at
162,123787082.0,Null checks fix and predicates logging.,165.0,23.0,10.0,4.0,1.0,0.0,0.0,2017-06-02 19:42:32,2017-06-02 20:32:55,Andrew Smith,12698945.0,0.0,
163,123789016.0,RYA-268 Adding Geoindexing Profile to Web project,166.0,164.0,69.0,6.0,1.0,9.0,0.0,2017-06-02 19:54:25,2017-07-13 03:48:09,Aaron Mihalik,4710489.0,0.0,
164,123803926.0,Testing Jenkins PR Build... Ignore this PR.,167.0,43.0,202213.0,1116.0,1.0,3.0,0.0,2017-06-02 21:29:18,2017-06-02 22:57:14,Aaron Mihalik,4710489.0,0.0,
165,123805127.0,Pr jenkins test2,168.0,43.0,202213.0,1116.0,2.0,5.0,0.0,2017-06-02 21:37:52,2017-06-03 00:22:16,Aaron Mihalik,4710489.0,0.0,
166,124714795.0,RYA-284: updated to support bloom filter,169.0,155.0,134.0,1.0,1.0,3.0,4.0,2017-06-08 18:27:20,2017-06-09 14:35:39,Tri H. Nguyen,26126888.0,0.0,
167,124882246.0,RYA-284: updated to support the use of bloom filter,170.0,29.0,2.0,1.0,1.0,6.0,0.0,2017-06-09 14:39:15,2017-08-21 18:26:10,Tri H. Nguyen,26126888.0,0.0,
168,125116640.0,RYA-288: corrected path to launch PcjAdminClient,171.0,2.0,2.0,1.0,1.0,4.0,0.0,2017-06-12 11:41:15,2017-08-03 16:01:03,Tri H. Nguyen,26126888.0,0.0,
169,126589470.0,RYA-303 Mongo PCJ Support,172.0,6733.0,3513.0,70.0,1.0,40.0,225.0,2017-06-20 17:36:10,2018-01-12 21:25:40,Andrew Smith,12698945.0,0.0,
170,127023779.0,RYA-304 Fixed rya.merger integration tests,173.0,43.0,42.0,5.0,1.0,1.0,5.0,2017-06-22 15:39:08,2017-06-22 20:19:37,,16158321.0,0.0,
171,127550462.0,RYA-291 Added owl:hasValue inference,174.0,806.0,7.0,7.0,1.0,4.0,22.0,2017-06-26 19:57:39,2017-07-20 21:17:09,,8652684.0,0.0,
172,130408775.0,Rya 268 Adding in Geo Predicate Filter List,175.0,165.0,69.0,6.0,2.0,1.0,0.0,2017-07-13 16:05:38,2017-07-13 16:06:05,Aaron Mihalik,4710489.0,0.0,
173,130409781.0,Rya 268,176.0,165.0,69.0,6.0,2.0,1.0,0.0,2017-07-13 16:10:03,2017-07-18 21:59:42,Aaron Mihalik,4710489.0,0.0,
174,130665914.0,RYA-280-Periodic Query Service,177.0,10660.0,470.0,138.0,1.0,6.0,76.0,2017-07-14 20:15:31,2017-08-02 21:02:09,,7217377.0,0.0,
175,131173303.0,RYA-315 Fixing issue with Core Indices on MongoDB,178.0,1.0,1.0,1.0,1.0,4.0,0.0,2017-07-18 19:57:33,2017-07-18 22:01:09,Aaron Mihalik,4710489.0,0.0,
176,131393258.0,RYA-309 Added delete support to indexers,179.0,167.0,0.0,2.0,2.0,10.0,8.0,2017-07-19 18:49:30,2017-07-27 10:46:40,Andrew Smith,12698945.0,0.0,
177,131669493.0,RYA-293 Added owl:unionOf inference,180.0,116.0,1.0,3.0,1.0,7.0,3.0,2017-07-20 23:15:35,2017-08-16 13:41:37,,8652684.0,0.0,
178,131861295.0,Rya-307 MongoDB Rya DAO Batch Writer,181.0,965.0,198.0,15.0,5.0,9.0,5.0,2017-07-21 21:24:01,2017-08-04 02:10:39,,16158321.0,0.0,
179,132370597.0,"RYA-324, RYA-272 Geo refactoring and examples",182.0,1746.0,221.0,60.0,2.0,28.0,23.0,2017-07-25 20:19:47,2017-08-30 20:31:52,David Lotts,6505463.0,0.0,
180,132371676.0,RYA-323 Enabling Multi Var Geo Functions. Closes #183,183.0,48.0,19.0,10.0,1.0,8.0,0.0,2017-07-25 20:25:09,2017-08-03 04:47:36,Aaron Mihalik,4710489.0,0.0,
181,132384420.0,RYA-297 Added owl:equivalentClass inference,184.0,156.0,46.0,4.0,1.0,4.0,0.0,2017-07-25 21:30:38,2017-08-16 23:10:22,,8652684.0,0.0,
182,132611599.0,RYA-216 Cleaned up maven build warnings and other issues in some poms.,185.0,45.0,115.0,5.0,1.0,3.0,0.0,2017-07-26 20:53:28,2017-07-28 02:12:40,,6537287.0,0.0,
183,132619023.0,Rya 317 Added Near function for geo mongodb,186.0,940.0,501.0,17.0,6.0,15.0,0.0,2017-07-26 21:30:36,2017-08-03 04:47:36,Andrew Smith,12698945.0,0.0,
184,132769969.0,Rya 317 Added Near function for geo mongodb,187.0,572.0,394.0,14.0,4.0,16.0,11.0,2017-07-27 14:58:24,2017-07-31 15:14:42,Aaron Mihalik,4710489.0,0.0,
185,132801464.0,"RYA-318 Rya Shell improvements for packaging, loading and querying.",188.0,1638.0,272.0,32.0,1.0,13.0,26.0,2017-07-27 17:19:34,2017-08-03 19:22:55,,6537287.0,0.0,
186,133285913.0,[WIP] RYA-329 Review Integration Tests (breaking build),189.0,389.0,341.0,10.0,6.0,19.0,0.0,2017-07-31 16:28:40,2017-08-02 13:27:33,,6537287.0,0.0,
187,133487156.0,RYA-330 Cleaned up build testing and added profile -P enable-it,190.0,291.0,341.0,9.0,1.0,10.0,0.0,2017-08-01 14:27:18,2017-08-01 20:35:29,,6537287.0,0.0,
188,133715429.0,RYA-306 Remove rya.benchmark committed gen,191.0,80.0,942.0,11.0,10.0,11.0,4.0,2017-08-02 13:56:46,2017-08-08 19:35:34,,16158321.0,0.0,
189,133763229.0,Rya 282 nested query,192.0,2906.0,804.0,64.0,1.0,3.0,0.0,2017-08-02 17:18:00,2017-08-18 18:51:38,,7217377.0,0.0,
190,133959274.0,Refactored the rya.periodic.notification.service.,193.0,15.0,40.0,49.0,1.0,5.0,0.0,2017-08-03 14:30:17,2017-08-03 20:08:21,,6537287.0,0.0,
191,134017821.0,RYA-325 Renamed rya.console to rya.shell.,194.0,5.0,3.0,39.0,1.0,1.0,3.0,2017-08-03 19:01:13,2017-08-04 13:37:58,,6537287.0,0.0,
192,134034533.0,Temp it fix,195.0,1.0,5.0,2.0,2.0,1.0,0.0,2017-08-03 20:29:33,2017-08-04 13:37:58,,6537287.0,0.0,
193,134061021.0,RYA-313,196.0,133.0,318.0,11.0,3.0,4.0,3.0,2017-08-03 23:11:06,2017-08-07 02:56:50,Andrew Smith,12698945.0,0.0,
194,134217679.0,"RYA-298, RYA-299 Domain/range inference.",197.0,582.0,12.0,6.0,1.0,5.0,5.0,2017-08-04 17:47:07,2017-08-18 14:54:23,,8652684.0,0.0,
195,134350437.0,Rya 283,198.0,3316.0,946.0,69.0,4.0,3.0,15.0,2017-08-07 01:48:03,2017-08-19 00:05:54,,7217377.0,0.0,
196,134488563.0,RYA-316 Long OBJ string,199.0,22.0,9.0,2.0,3.0,16.0,13.0,2017-08-07 17:32:56,2017-08-10 17:48:11,Andrew Smith,12698945.0,0.0,
197,134529051.0,Added Access-Control-Allow-Origin * header to both response objects,200.0,2.0,0.0,1.0,2.0,1.0,0.0,2017-08-07 21:17:49,2017-08-18 15:23:16,,10409332.0,0.0,
198,134754013.0,RYA-295 owl:allValuesFrom inference,201.0,440.0,3.0,7.0,1.0,5.0,1.0,2017-08-08 20:42:31,2017-08-19 02:04:35,,8652684.0,0.0,
199,135257588.0,Fixes a regression with QueriesBenchmarkConfReaderIT,203.0,5.0,1.0,1.0,1.0,2.0,0.0,2017-08-11 02:25:27,2017-08-11 18:56:10,,6537287.0,0.0,
200,135603250.0,RYA-337 Adding batch queries to MongoDB. Closes #204,204.0,165.0,318.0,6.0,2.0,3.0,11.0,2017-08-14 13:59:07,2017-08-19 01:44:06,Aaron Mihalik,4710489.0,0.0,
201,135668672.0,RYA-343 Fixed rya.api connection issue for PCJ-enabled rya table.,205.0,14.0,11.0,2.0,1.0,1.0,4.0,2017-08-14 19:28:38,2017-08-16 19:37:55,,6537287.0,0.0,
202,135826700.0,RYA-292 Added owl:intersectionOf inference.,206.0,2068.0,978.0,20.0,1.0,9.0,41.0,2017-08-15 15:31:51,2017-08-23 15:47:19,,16158321.0,0.0,
203,135852958.0,RYA-340 Added dependency filtering to rya.pcj.fluo.app for deployments.,207.0,180.0,142.0,12.0,1.0,3.0,0.0,2017-08-15 17:45:19,2017-08-16 22:48:00,,6537287.0,0.0,
204,135881517.0,fix-mongo-tests,208.0,24.0,10.0,2.0,1.0,8.0,0.0,2017-08-15 20:13:21,2017-08-16 20:53:31,,6537287.0,0.0,
205,136077639.0,Rya 296 hasSelf,209.0,430.0,11.0,7.0,1.0,7.0,44.0,2017-08-16 17:16:30,2017-08-25 20:38:11,Andrew Smith,12698945.0,0.0,
206,136801473.0,RYA-346-Removed duplicate RyaExportIT and fixed failing GeoFunctionsIT,210.0,9.0,187.0,3.0,1.0,1.0,0.0,2017-08-21 16:47:13,2017-08-21 18:26:10,,7217377.0,0.0,
207,136823127.0,Changed Kafka version to 0.10.0.1 for compatibility with older brokers.,211.0,1.0,1.0,1.0,1.0,2.0,0.0,2017-08-21 19:09:07,2017-08-21 23:08:51,,6537287.0,0.0,
208,137061219.0,RYA-332 rename integration tests,212.0,21.0,131.0,7.0,1.0,5.0,0.0,2017-08-22 19:32:42,2017-08-25 16:45:02,Andrew Smith,12698945.0,0.0,
209,137069396.0,RYA-246-Query-Export-Strategy,213.0,1527.0,753.0,78.0,3.0,3.0,21.0,2017-08-22 20:14:46,2017-08-25 19:35:43,,7217377.0,0.0,
210,137125571.0,RYA-350 Added EmbeddedKafkaSingleton to help eliminate flaky ITs.,214.0,493.0,147.0,7.0,3.0,7.0,0.0,2017-08-23 03:55:25,2017-08-25 19:35:43,,6537287.0,0.0,
211,137261864.0,RYA-300 Added owl:oneOf inference.,215.0,633.0,2.0,8.0,1.0,6.0,18.0,2017-08-23 16:23:07,2017-08-24 22:27:50,,16158321.0,0.0,
212,137277172.0,Rya-289 Mongo Singleton tests,216.0,276.0,538.0,29.0,1.0,9.0,29.0,2017-08-23 17:39:54,2017-08-25 16:45:02,Andrew Smith,12698945.0,0.0,
213,137355422.0,RYA-294 owl:someValuesFrom inference,217.0,639.0,54.0,9.0,1.0,5.0,9.0,2017-08-24 02:13:18,2017-08-25 17:56:34,,8652684.0,0.0,
214,138055146.0,RYA-301 owl:ReflexiveProperty inference,218.0,517.0,49.0,15.0,1.0,3.0,4.0,2017-08-28 22:55:35,2017-09-01 16:52:18,,8652684.0,0.0,
215,138311919.0,Creating inference Examples,219.0,598.0,0.0,2.0,3.0,2.0,4.0,2017-08-30 00:17:59,2017-10-03 19:18:33,,31431649.0,0.0,
216,138577699.0,Rya 319,220.0,1881.0,461.0,72.0,1.0,5.0,35.0,2017-08-31 04:19:41,2017-09-04 13:14:17,,7217377.0,0.0,
217,139223887.0,RYA-355 Refactored the periodic notification service structure.,221.0,30.0,45.0,54.0,1.0,2.0,0.0,2017-09-05 01:45:00,2017-09-11 16:14:48,,6537287.0,0.0,
218,139634434.0,RYA-360 Fixed licensing issues.,222.0,170.0,125.0,24.0,1.0,2.0,0.0,2017-09-06 18:34:21,2017-09-08 19:06:33,,6537287.0,0.0,
219,139852071.0,RYA-362 Improved UX for case where create-pcj is called without args.,223.0,32.0,12.0,2.0,1.0,1.0,0.0,2017-09-07 16:35:16,2017-09-08 19:06:33,,6537287.0,0.0,
220,140045130.0,RYA-361 Remove JCalendar library from merge/copy/export,224.0,21.0,422.0,11.0,2.0,7.0,1.0,2017-09-08 14:03:26,2017-09-08 19:06:33,David Lotts,6505463.0,0.0,
221,140910788.0,RYA-370 Improvements from review of 3.2.11-RC2,225.0,198.0,170.0,7.0,1.0,3.0,0.0,2017-09-13 19:33:01,2017-09-19 21:44:21,,6537287.0,0.0,
222,140985590.0,RYA-342 RYA-321 Added documentation on the shell and PCJ Updater,226.0,853.0,4.0,6.0,1.0,3.0,0.0,2017-09-14 05:26:30,2017-09-29 20:12:37,,6537287.0,0.0,
223,141371436.0,RYA-372 Excluded org.json:json for incompatible license,227.0,26.0,0.0,1.0,2.0,13.0,1.0,2017-09-15 18:18:59,2017-09-19 21:44:21,David Lotts,6505463.0,0.0,
224,141377326.0,[WIP] RYA-373 Make Benchmarks optional ,228.0,0.0,0.0,0.0,0.0,1.0,0.0,2017-09-15 18:48:57,2017-09-16 04:45:41,David Lotts,6505463.0,0.0,
225,141459998.0,RYA-373 Make Benchmarks optional by profile,229.0,6.0,2.0,1.0,1.0,5.0,1.0,2017-09-16 19:59:58,2017-09-19 21:44:21,David Lotts,6505463.0,0.0,
226,142371731.0,RYA-371 Added scripts to run MongoRyaDirectExample,230.0,154.0,3.0,6.0,1.0,3.0,0.0,2017-09-21 15:16:36,2017-10-03 19:12:33,,16158321.0,0.0,
227,143281921.0,Rya mongo shell [WIP] RYA-368,231.0,2209.0,0.0,18.0,5.0,1.0,0.0,2017-09-27 01:58:17,2018-01-05 20:04:47,,31431649.0,0.0,
228,144283302.0,RYA-385 Fixed the BindingSetDecorator and VisibilityBinidngSet hashCo…,232.0,78.0,32.0,4.0,1.0,3.0,0.0,2017-10-02 21:03:33,2017-10-03 16:01:51,,16141852.0,0.0,
229,144502620.0,RYA-387 Restored Mongo IT's that were not being exercised.,233.0,2.0,2.0,2.0,1.0,2.0,0.0,2017-10-03 19:05:14,2017-10-06 17:12:01,,6537287.0,0.0,
230,144509715.0,RYA-390 Fixed a failing integration test.,234.0,10.0,4.0,1.0,1.0,1.0,0.0,2017-10-03 19:38:49,2017-10-06 18:23:57,,16141852.0,0.0,
231,144517199.0,RYA-391 Added missing Apache 2.0 lisence headers.,235.0,38.0,0.0,2.0,1.0,2.0,0.0,2017-10-03 20:13:14,2017-10-06 18:23:39,,16141852.0,0.0,
232,144701616.0,RYA-393 MongoDB Batch Writer Duplicate Key Exception,236.0,239.0,3.0,8.0,3.0,11.0,0.0,2017-10-04 15:27:52,2017-10-24 13:40:45,,16158321.0,0.0,
233,144751558.0,RYA-392-Datetime-Within,237.0,611.0,5.0,8.0,1.0,5.0,43.0,2017-10-04 19:11:08,2017-10-12 18:43:36,,7217377.0,0.0,
234,144972888.0,RYA-397 Renamed MockMongoSingleton/Factory to Embedded,238.0,27.0,27.0,9.0,1.0,4.0,0.0,2017-10-05 17:14:21,2017-10-12 18:43:36,Andrew Smith,12698945.0,0.0,
235,145015383.0,Rya 398,239.0,32.0,38.0,11.0,2.0,4.0,1.0,2017-10-05 20:39:47,2017-10-12 18:43:36,Andrew Smith,12698945.0,0.0,
236,145478854.0,Rya 374,240.0,2278.0,794.0,40.0,5.0,4.0,40.0,2017-10-09 15:11:40,2017-11-21 16:08:56,,7217377.0,0.0,
237,145727744.0,"RYA-333 Added ""-P coverage"" to generate code coverage reports.",241.0,1663.0,2400.0,49.0,2.0,5.0,2.0,2017-10-10 15:35:01,2017-10-12 18:43:35,,6537287.0,0.0,
238,145818496.0,RYA-402 Create Kafka reusable test code project.,242.0,360.0,177.0,21.0,1.0,5.0,2.0,2017-10-10 22:39:16,2017-10-12 18:43:35,,16141852.0,0.0,
239,146202430.0,"RYA-401 Added findbugs policy to build, fixed all default charset bugs.",243.0,1615.0,2378.0,48.0,1.0,1.0,0.0,2017-10-12 13:00:39,2017-10-12 18:43:35,,6537287.0,0.0,
240,146435518.0,RYA-358 Added checkstyle policy to build and fixed problems.,244.0,190.0,86.0,25.0,1.0,1.0,0.0,2017-10-13 11:36:55,2017-10-13 17:02:17,,6537287.0,0.0,
241,147324379.0,[RYA-405] Migrate from Sesame to rdf4j libs,245.0,10238.0,10635.0,628.0,19.0,41.0,14.0,2017-10-18 14:55:38,2018-04-24 20:57:43,Jorge,4804546.0,0.0,
242,147617125.0,RYA-284: updated to support the use of bloom filter,246.0,69.0,21.0,1.0,1.0,1.0,0.0,2017-10-19 17:25:11,2017-10-19 19:56:38,,7217377.0,0.0,
243,148223919.0,[WIP] RYA-284: updated to support the use of bloom filter,247.0,166.0,41.0,2.0,4.0,5.0,0.0,2017-10-23 19:51:08,2018-01-05 20:02:24,David Lotts,6505463.0,0.0,
244,148985067.0,RYA-356 Added a Twill App for running the periodic service,248.0,3619.0,824.0,83.0,1.0,2.0,16.0,2017-10-26 16:31:59,2017-11-07 15:50:53,,6537287.0,0.0,
245,153353132.0,[WIP] Rya-104 for 2017 mongo admin shell,249.0,2563.0,304.0,47.0,12.0,13.0,5.0,2017-11-17 17:31:04,2018-01-05 20:03:01,David Lotts,6505463.0,0.0,
246,154177858.0,[WIP] RYA-238  Accumulo Geo Temporal Index,250.0,1740.0,30.0,19.0,2.0,2.0,0.0,2017-11-22 15:06:22,2018-01-05 20:03:17,David Lotts,6505463.0,0.0,
247,154184929.0,Candidate/rya 406,251.0,2045.0,408.0,58.0,2.0,4.0,189.0,2017-11-22 15:32:25,2017-12-05 19:49:35,,7217377.0,0.0,
248,156306603.0,RYA-410 Add geo profile dependency management to the rya-project pom file.,252.0,191.0,235.0,9.0,1.0,6.0,4.0,2017-12-04 21:09:19,2018-01-18 16:40:15,,16141852.0,0.0,
249,159235269.0,RYA-413 Fixed how MongoDBRyaDAO closed its internal mongoClient.  Updated AbstractMongoDBRdfConfigurationBuilder config tags.,253.0,1042.0,177.0,35.0,4.0,7.0,0.0,2017-12-19 18:08:03,2018-01-16 18:10:02,,16158321.0,0.0,
250,159766283.0,RYA-416 Optionally invoke aggregation pipeline to execute MongoDB queries,254.0,2446.0,7.0,12.0,1.0,9.0,43.0,2017-12-21 22:45:45,2018-01-11 14:52:15,,8652684.0,0.0,
251,159935327.0,RYA-417 Forward-chaining batch rules engine,255.0,5887.0,34.0,41.0,2.0,8.0,25.0,2017-12-22 21:23:42,2018-01-11 14:52:15,,8652684.0,0.0,
252,160294897.0,RYA-414,256.0,3664.0,3594.0,77.0,4.0,2.0,36.0,2017-12-27 19:48:31,2018-01-04 22:07:36,,16141852.0,0.0,
253,160433582.0,RYA-377 Rya Streams,257.0,17641.0,1245.0,250.0,71.0,13.0,33.0,2017-12-28 19:38:21,2018-01-09 21:51:13,,16141852.0,0.0,
254,160782883.0,RYA-104 Mongo Rya Shell Integration,258.0,3059.0,465.0,49.0,12.0,6.0,12.0,2018-01-02 18:58:23,2018-01-06 00:39:15,,16141852.0,1.0,2018-01-06 00:39:15
255,161418661.0,RYA-421 Updated the Rya Shell to print a different message when there are no Rya instances to list.,259.0,3067.0,466.0,49.0,13.0,2.0,0.0,2018-01-05 20:15:36,2018-01-06 00:39:15,,16141852.0,1.0,2018-01-06 00:39:15
256,161426716.0,RYA-422 Corrected the text that is written when executing the 'print-instance-details' command of Rya Shell when connected to Mongo DB.,260.0,3150.0,503.0,51.0,14.0,3.0,0.0,2018-01-05 21:01:48,2018-01-08 18:55:08,,16141852.0,0.0,
257,161727350.0,RYA-427 Fixed connect to mongo failure,261.0,31.0,9.0,3.0,1.0,11.0,6.0,2018-01-08 21:16:08,2018-01-09 21:48:32,Andrew Smith,12698945.0,1.0,2018-01-09 21:48:31
258,161761449.0,RYA-428 Made the Rya Shell's load statements file command accept relative paths.,262.0,44.0,5.0,2.0,1.0,2.0,0.0,2018-01-09 00:47:07,2018-01-11 14:52:14,,16141852.0,0.0,
259,163249865.0,RYA-413 Fixed how MongoDBRyaDAO closed its internal mongoClient. Updated AbstractMongoDBRdfConfigurationBuilder config tags.,263.0,288.0,16.0,5.0,1.0,1.0,0.0,2018-01-16 18:08:31,2018-01-18 16:40:15,,16158321.0,0.0,
260,163254236.0,RYA-447 Fixed issue building rya.shell under Windows.  Loading data from relative path test failed due to malformed user.home paths.,264.0,6.0,1.0,1.0,1.0,9.0,0.0,2018-01-16 18:29:32,2018-02-02 17:47:42,,16158321.0,0.0,
261,163304265.0,RYA-442 Implementing the Start and Stop Query interactors.,265.0,424.0,173.0,18.0,1.0,5.0,7.0,2018-01-16 22:30:57,2018-01-18 21:00:39,,16141852.0,0.0,
262,164104889.0,[WIP] RYA-238 Geotemporal Accumulo Upgrade,266.0,2044.0,30.0,21.0,2.0,6.0,0.0,2018-01-20 02:02:11,2018-02-02 15:54:21,David Lotts,6505463.0,0.0,
263,164106670.0,RYA-440 Added commands to Rya Shell used to interact with Rya Streams.,267.0,2101.0,52.0,27.0,1.0,3.0,21.0,2018-01-20 02:41:53,2018-01-29 20:36:57,,16141852.0,0.0,
264,164444706.0,RYA-448,268.0,654.0,0.0,11.0,4.0,1.0,0.0,2018-01-22 23:28:43,2018-01-22 23:29:04,,16141852.0,0.0,
265,165218055.0,RYA-459 Fixed handling of comma-separated property file values in AccumuloIndexingConfiguration and MongoIndexingConfiguration,269.0,116.0,110.0,2.0,1.0,4.0,2.0,2018-01-25 20:17:37,2018-02-02 17:50:14,,16158321.0,0.0,
266,166874062.0,RYA-461 Fixed log flooding from querying/adding statements in MongoDB Rya,271.0,13.0,13.0,1.0,1.0,2.0,0.0,2018-02-02 18:38:38,2018-02-08 20:22:38,,16158321.0,0.0,
267,168089046.0,RYA-443 Rya Streams Query Manager daemon program.,272.0,5157.0,118.0,55.0,16.0,5.0,41.0,2018-02-08 21:15:46,2018-03-02 19:17:59,,16141852.0,0.0,
268,168729464.0,Updating the Rya Manual to include Rya Streams.,273.0,390.0,1.0,5.0,1.0,10.0,37.0,2018-02-13 01:04:18,2018-03-09 17:37:27,,16141852.0,0.0,
269,169141421.0,Added giraph profile to resolve an incompatible license issue.,274.0,9.0,1.0,1.0,1.0,4.0,0.0,2018-02-14 15:31:36,2018-02-19 19:58:40,,6537287.0,0.0,
270,169449249.0,RYA-466 Update the Rya Streams Client to stream results to file.,275.0,551.0,11.0,6.0,1.0,8.0,11.0,2018-02-15 18:26:39,2018-03-02 19:17:34,,16141852.0,0.0,
271,169536099.0,updated quick start vm readme,276.0,3.0,2.0,2.0,2.0,2.0,0.0,2018-02-16 02:25:15,2018-02-16 17:11:43,Jacob Strong,25963322.0,0.0,
272,170600627.0,Rya 460,277.0,5782.0,256.0,76.0,17.0,2.0,0.0,2018-02-21 22:01:04,2018-03-02 19:17:43,,16141852.0,0.0,
273,170943419.0,RYA-269 Remove references to mvm,278.0,4.0,4.0,3.0,1.0,4.0,0.0,2018-02-23 06:41:04,2018-03-09 17:42:25,Wolfgang Amann,8766375.0,0.0,
274,172351444.0,Rya streams base,279.0,6134.0,260.0,79.0,20.0,1.0,0.0,2018-03-01 20:56:51,2018-03-09 18:20:58,Andrew Smith,12698945.0,0.0,
275,174378247.0,POM version fix,281.0,2.0,2.0,1.0,1.0,1.0,0.0,2018-03-12 14:06:59,2018-03-14 19:17:12,,6537287.0,0.0,
276,174754708.0,RYA-443 Fixed Rya Streams Query Manager RPM version,282.0,65.0,13.0,1.0,2.0,19.0,0.0,2018-03-13 18:44:05,2018-04-25 16:13:40,,16158321.0,0.0,
277,175001799.0,Fixed tests that are sensitive to DST spring forward.,283.0,10.0,9.0,2.0,2.0,10.0,0.0,2018-03-14 15:55:10,2018-03-20 17:24:31,David Lotts,6505463.0,1.0,2018-03-20 17:24:30
278,175390776.0,Reverting the RPM build to use the RPM command again. The RPM build i…,284.0,76.0,101.0,2.0,2.0,2.0,0.0,2018-03-15 22:01:49,2018-04-06 15:56:46,,16141852.0,0.0,
279,178617413.0,RYA-469 Added tests for Rya Streams join iterator bug using LUBM data.,285.0,202558.0,21.0,18.0,4.0,4.0,6.0,2018-03-30 19:08:47,2018-04-06 16:00:50,,16158321.0,0.0,
280,178876534.0,RYA-467 update topic cleanup.policy,286.0,137.0,6.0,6.0,2.0,4.0,4.0,2018-04-02 16:43:35,2018-04-16 18:54:45,Andrew Smith,12698945.0,0.0,
281,180045147.0,Updating the ExecuteSparqlQuery command to return BindingSets,287.0,253.0,175.0,8.0,1.0,1.0,0.0,2018-04-06 20:21:06,2018-04-16 18:57:14,Andrew Smith,12698945.0,0.0,
282,181198779.0,RYA-485 Fixed issues with maven-shade-plugin.,288.0,52.0,50.0,7.0,1.0,6.0,0.0,2018-04-12 13:14:13,2018-04-16 18:59:42,,6537287.0,0.0,
283,182047794.0,RYA-486 Updated the project's version to 4.0.0-incubating-SNAPSHOT.,289.0,70.0,70.0,69.0,1.0,2.0,0.0,2018-04-17 04:21:01,2018-04-23 13:17:41,,16141852.0,0.0,
284,182300169.0,RYA-488 Moved the Geo Indexing specific maven repositories into the g…,290.0,78.0,78.0,1.0,1.0,7.0,0.0,2018-04-17 21:12:21,2018-05-01 15:48:26,,16141852.0,0.0,
285,182579457.0,RYA-405 Migration of OpenRDF Sesame libraries to RDF4J,291.0,14264.0,14508.0,874.0,6.0,9.0,18.0,2018-04-18 19:28:34,2018-04-23 13:21:22,,16158321.0,0.0,
286,182937355.0,RYA-489 Moved common Accumulo integration test code to the rya.test.accumulo project.,292.0,265.0,254.0,32.0,1.0,5.0,0.0,2018-04-20 01:19:08,2018-05-01 15:50:29,,16141852.0,0.0,
287,183867949.0,RYA-491 Repackaged reusable Mongo DB test code into a project named '…,293.0,777.0,632.0,97.0,2.0,4.0,6.0,2018-04-24 21:21:51,2018-05-01 15:52:13,,16141852.0,0.0,
288,184704707.0,RYA-492 Added language support for Literals,294.0,2704.0,456.0,40.0,1.0,12.0,6.0,2018-04-27 19:13:31,2018-05-16 15:49:12,,16158321.0,0.0,
289,186971788.0,RYA-494 Fixed a bug where the shell was not loading or displaying all…,295.0,281.0,2.0,6.0,1.0,3.0,8.0,2018-05-09 16:17:19,2018-05-16 15:51:54,,16141852.0,0.0,
290,187248377.0,RYA-487 Kafka Connect Sinks,296.0,3918.0,60.0,54.0,2.0,5.0,72.0,2018-05-10 16:59:05,2018-05-16 15:53:30,,16141852.0,0.0,
291,188824870.0,RYA-495 Updated the Vagrantfile's dependencies,297.0,111.0,104.0,2.0,1.0,1.0,0.0,2018-05-17 18:34:41,2018-06-04 16:59:20,,16158321.0,0.0,
292,189805458.0,RYA-497 Make the Rya Accumulo Kafka Connect Sink batch write instead …,298.0,1.0,0.0,1.0,1.0,3.0,0.0,2018-05-22 22:03:48,2018-06-04 16:56:52,,16141852.0,0.0,
293,199201639.0,RYA-500: Make RdfFileInputTool to accept multiple input paths. Doc improvements,299.0,114.0,134.0,10.0,4.0,4.0,4.0,2018-07-04 10:10:09,2018-10-01 13:15:15,Maksim Kolchin,189642.0,0.0,
294,215653211.0,RYA-135 Hard code triples collection,300.0,145.0,211.0,30.0,3.0,4.0,10.0,2018-09-14 16:52:18,2018-10-01 15:06:21,Andrew Smith,12698945.0,0.0,
295,215653775.0,RYA-501 change from Guava Iterators to Java Collections,301.0,5.0,5.0,1.0,1.0,3.0,0.0,2018-09-14 16:54:42,2018-09-14 17:42:10,Andrew Smith,12698945.0,0.0,
296,215664362.0,RYA-501 Change guava Iterators to Collections,302.0,5.0,5.0,1.0,1.0,4.0,0.0,2018-09-14 17:41:53,2018-10-01 15:04:32,Andrew Smith,12698945.0,0.0,
297,215665195.0,RYA-135 Hard code triples collection,303.0,145.0,211.0,30.0,3.0,5.0,0.0,2018-09-14 17:45:34,2018-09-27 17:09:29,Andrew Smith,12698945.0,0.0,
298,220186209.0,Repsynch updating child,306.0,2134.0,2326.0,65.0,2.0,1.0,0.0,2018-10-03 21:29:41,2018-10-03 21:33:25,Andrew Smith,12698945.0,0.0,
299,288021892.0,Rya 515 Upgraded mongo-java-driver to 3.10.2,310.0,2125.0,1668.0,77.0,6.0,2.0,0.0,2019-06-13 17:19:11,2019-06-25 13:06:26,,16158321.0,0.0,
300,297734936.0,"Don't switch on null value, instead switch on valid type, use Map.getOrDefault()",311.0,148.0,2.0,2.0,2.0,1.0,2.0,2019-07-15 18:24:54,2020-11-26 05:46:39,Ryan Lantzy,4174099.0,0.0,
